nom_bassin_versant,latitude_centroide,longitude_centroide,quantile_prelevement_national,score_secheresse,classe_secheresse,classe_prelevement,classe_bivariee,volume_moyen_preleve_m3_an,nb_communes,rang_secheresse_national
Le Durgeon de sa source au Bâtard,47.7027,6.2636,76.2,0.0,faible/nulle,fort,0-2,1867398.2,11,0.0
L'Orvin de sa source au confluent du Sainte Elisabeth (exclu),48.35,3.6219,62.59,0.0,faible/nulle,modere,0-1,731402.4,10,0.0
La Bresse de sa source au confluent de l'Aube (exclu),48.2595,4.7559,97.27,0.0,faible/nulle,fort,0-2,379501971.0,6,0.0
L'Orvin du confluent du Sainte Elisabeth (inclus) au confluent de la Seine (exclu),48.4037,3.4946,61.72,1.84,faible/nulle,modere,0-1,695947.2,8,84.7
La Seine du confluent de l'Yonne (exclu) au confluent du Loing (exclu),48.3876,2.8969,99.52,0.0,faible/nulle,fort,0-2,5840886152.6,6,0.0
La Challouette de sa source au confluent de la Juine (exclu),48.4032,2.0255,85.8,0.53,faible/nulle,fort,0-2,5152799.0,15,80.8
L'Eure du confluent du rau du Coinon (exclu) au confluent du ruisseau d'Houdouenne (inclus),48.3934,1.3716,81.27,0.0,faible/nulle,fort,0-2,3054019.2,18,0.0
L'Aube du confluent de la Bresse (exclu) au confluent du Landion (exclu),48.2688,4.6726,25.42,0.0,faible/nulle,faible,0-0,43798.4,3,0.0
Le Rognon du confluent de la Joux (exclu) au confluent de la Marne (exclu),48.3259,5.2316,97.9,0.0,faible/nulle,fort,0-2,551831028.8,6,0.0
LE COUESNON DU GENERAL (NC) A LA MINETTE (NC),48.3134,-1.4191,8.13,0.0,faible/nulle,faible,0-0,0.0,3,0.0
Le Rognon du confluent de la Sueurre (exclu) au confluent de la Joux (exclu),48.2626,5.2517,22.48,0.0,faible/nulle,faible,0-0,27540.8,3,0.0
La Moselotte de la Cleurie à la Moselle.,48.0091,6.6571,31.41,0.0,faible/nulle,faible,0-0,85755.4,2,0.0
Le ruisseau d'Huison de sa source au confluent de l'Essonne (exclu),48.3789,2.2774,80.29,5.19,moderee,fort,1-2,2718744.6,14,91.9
La Barse du confluent de la Boderonne (exclu) au confluent de la Civanne (exclu),48.2684,4.2899,99.42,0.0,faible/nulle,fort,0-2,3687818154.4,5,0.0
L'Ill de la Fecht au Horgiessen.,48.2188,7.4414,8.13,0.0,faible/nulle,faible,0-0,0.0,0,0.0
L'Auzon de sa source au confluent du Longsols (exclu),48.3533,4.3592,31.8,0.0,faible/nulle,faible,0-0,88720.0,6,0.0
Le Luy du confluent du Cazeaux au confluent du Grand Arrigan,43.6633,-0.9262,71.61,1.57,faible/nulle,fort,0-2,1345692.4,5,83.7
LE LOIR DE SA SOURCE A LA THIRONNE (NC),48.3495,1.1695,66.91,0.0,faible/nulle,fort,0-2,973736.8,10,0.0
LA CLOCHE & SES AFFLUENTS,48.3562,0.9466,65.92,5.33,moderee,modere,1-1,913413.2,6,92.1
LE GENERAL & SES AFFLUENTS,48.2669,-1.2833,45.47,0.0,faible/nulle,modere,0-1,247236.2,4,0.0
Le Ceffondet de sa source au confluent de la Voire (exclu),48.3517,4.8066,19.7,0.0,faible/nulle,faible,0-0,13953.4,9,0.0
Le Bouyic,43.7431,-1.2813,8.13,0.0,faible/nulle,faible,0-0,0.0,0,0.0
La Marne du confluent du ruisseau d'Oudincourt (exclu) au confluent du Rognon (exclu),48.2927,5.1216,92.39,0.0,faible/nulle,fort,0-2,30597195.2,8,0.0
La Corrèze du confluent du Pian (inclus) au confluent du Maumont Blanc,45.139,1.5306,20.91,0.0,faible/nulle,faible,0-0,20006.2,2,0.0
L'Yonne du confluent de l'Oreuse (exclu) au confluent de la Seine (exclu),48.33,3.1774,99.5,7.57,forte,fort,2-2,5059683638.0,19,95.2
La Vère du confluent du Bonnefon (inclus) au confluent de la Vervère,43.9929,1.9154,39.52,10.89,forte,modere,2-1,168635.2,6,97.6
L'Ecole de sa source au confluent de la Seine (exclu),48.3992,2.52,82.47,8.77,forte,fort,2-2,3420951.2,29,96.3
La Meurthe de la Petite Meurthe à la Fave.,48.2143,6.9628,64.31,0.0,faible/nulle,modere,0-1,823661.8,6,0.0
La Vézère du confluent du Galingard (Alembre) au confluent de la Soudaine,45.5301,1.7823,8.13,7.45,forte,faible,2-0,0.0,0,95.1
L'Avière du ruisseau des Roseaux au Corbé (inclus).,48.2104,6.3603,31.33,4.44,moderee,faible,1-0,85060.6,5,90.7
Le canal du centre,45.3658,-0.6301,52.21,0.0,faible/nulle,modere,0-1,388962.8,6,0.0
Le Loing du confluent de l'Aveyron (exclu) au confluent de l'Ouanne (exclu),47.9006,2.8282,68.15,0.0,faible/nulle,fort,0-2,1073600.6,2,0.0
L'Yonne du confluent de la Vanne (exclu) au confluent de l'Oreuse (inclus),48.2564,3.3043,90.56,0.0,faible/nulle,fort,0-2,14907838.8,20,0.0
La Barse du confluent du ruisseau de l'Etang de Fort en Paille (inclus) au confluent de la Boderonne (exclu),48.2406,4.3783,8.13,0.0,faible/nulle,faible,0-0,0.0,5,0.0
La Barse du confluent de la Civanne (exclu) au confluent de la Seine (exclu),48.2999,4.1666,75.12,0.0,faible/nulle,fort,0-2,1709896.6,11,0.0
Le Blaiseron de sa source au confluent de la Blaise (exclu),48.3235,5.0201,38.02,0.0,faible/nulle,modere,0-1,152123.4,13,0.0
L'Hozain du confluent de la Mogne (exclu) au confluent de la Seine (exclu),48.2348,4.1167,84.57,0.0,faible/nulle,fort,0-2,4378538.0,2,0.0
L'ILLE DE SA SOURCE A L'ILLET (NC),48.2957,-1.673,51.07,0.0,faible/nulle,modere,0-1,366784.8,12,0.0
La Fecht du Strengbach à l'Ill.,48.1628,7.3778,70.82,0.0,faible/nulle,fort,0-2,1280712.4,2,0.0
La Barse de sa source au confluent du ruisseau de l'Etang de Fort en Paille (exclu),48.2109,4.4992,41.4,0.0,faible/nulle,modere,0-1,189956.6,9,0.0
L'HUISNE DE LA CLOCHE (NC) A L'ERRE (NC),48.2754,0.8592,58.57,0.0,faible/nulle,modere,0-1,564950.8,9,0.0
LA VEUVRE DU RAU DE LA BARBOTAIS (NC) A LA VILAINE (NC),48.1798,-1.4867,18.29,0.0,faible/nulle,faible,0-0,7252.6,3,0.0
La Boderonne de sa source au confluent de la Barse (exclu),48.1898,4.363,8.13,0.0,faible/nulle,faible,0-0,0.0,5,0.0
L'Auvézère de sa source au confluent du Chastre (inclus),45.5194,1.4923,26.03,0.0,faible/nulle,faible,0-0,47232.2,2,0.0
L'Hozain du confluent du ru de Vérien (exclu) au confluent de la Mogne (exclu),48.1808,4.1508,63.48,0.0,faible/nulle,modere,0-1,782811.4,3,0.0
La Seine du confluent de l'Hozain (exclu) au confluent de la Vienne (exclu),48.2416,4.0376,65.97,0.0,faible/nulle,modere,0-1,914550.8,8,0.0
Le ruisseau de Meures de sa source au confluent de la Marne (exclu),48.1836,5.0838,18.16,0.0,faible/nulle,faible,0-0,6868.2,3,0.0
Le Douyge,45.437,1.8491,22.52,0.0,faible/nulle,faible,0-0,27775.8,1,0.0
L'Aube du confluent de l'Aujon (exclu) au confluent de la Bresse (exclu),48.2113,4.773,44.21,0.0,faible/nulle,modere,0-1,227074.6,7,0.0
La Moselle de la Suche à la Vologne.,48.0875,6.6212,60.64,0.0,faible/nulle,modere,0-1,638401.8,2,0.0
L'Isère du Chaussère à la Bourne,45.1527,5.3208,82.29,1.84,faible/nulle,fort,0-2,3385206.0,7,84.7
La Dhuy de sa source au confluent de l'Aujon (exclu),48.0625,4.9552,30.17,0.0,faible/nulle,faible,0-0,75325.6,1,0.0
La Corrèze du confluent de la Gimelle (Montane) au confluent du [toponyme inconnu] (inclus),45.2322,1.7336,49.44,0.0,faible/nulle,modere,0-1,327280.0,2,0.0
L'Aveyron du confluent de la Lère Morte au confluent de la Tauge,44.1085,1.4067,8.13,0.0,faible/nulle,faible,0-0,0.0,0,0.0
L'ILLE DE L'ILLET (NC) A LA VILAINE (NC),48.1552,-1.672,51.79,0.0,faible/nulle,modere,0-1,381463.6,3,0.0
LA VILAINE DE L'ILLE (NC) A LA FLUME (NC),48.1193,-1.724,8.13,0.0,faible/nulle,faible,0-0,0.0,1,0.0
La Saône du Ravin à la Gourgeonne,47.5925,5.8593,98.24,0.0,faible/nulle,fort,0-2,699839103.8,8,0.0
LE LIE DU RAU DE FRAMEUX (NC) AU J814500 (C),48.109,-2.6682,8.13,0.0,faible/nulle,faible,0-0,0.0,2,0.0
La Fecht du Krebsbach à la Weiss.,48.0777,7.2445,37.57,0.0,faible/nulle,modere,0-1,146871.6,7,0.0
Le Rhône de la Galaure au Doux,45.13,4.7858,99.84,0.0,faible/nulle,fort,0-2,23499885954.2,14,0.0
Le Fusain du confluent du Petit Fusain (exclu) au confluent du Loing (exclu),48.1132,2.6714,77.7,7.34,forte,fort,2-2,2145604.0,5,94.9
L'Yonne du confluent de l'Armance (exclu) au confluent du Beuvron (exclu),47.4552,3.5509,8.13,0.0,faible/nulle,faible,0-0,0.0,2,0.0
L'Ource du confluent du Landion (exclu) au confluent du ru de Noé (exclu),48.049,4.5661,55.36,0.0,faible/nulle,modere,0-1,468389.6,2,0.0
L'Aujon du confluent du ru du Val Mormand (exclu) au confluent de la Dhuy (exclu),48.0492,4.8945,19.78,0.0,faible/nulle,faible,0-0,14229.8,1,0.0
Le Madon de sa source au ruisseau des Etangs (la Craque) (inclus).,48.1259,6.1711,38.33,0.0,faible/nulle,modere,0-1,155415.2,3,0.0
Le Rognon du confluent du Seuillon (exclu) au confluent de la Sueurre (exclu),48.1707,5.3473,43.17,0.0,faible/nulle,modere,0-1,215266.2,6,0.0
La Reyssouze du Clairtant au Jugnon,46.2036,5.2639,49.14,0.0,faible/nulle,modere,0-1,319514.0,4,0.0
Le Loing du confluent du Lunain (exclu) au confluent de la Seine (exclu),48.2802,2.9786,82.44,8.38,forte,fort,2-2,3416684.6,17,96.0
Le Loing du confluent du Fusain (exclu) au confluent du Lunain (exclu),48.2528,2.6778,93.15,6.92,forte,fort,2-2,43473709.4,25,94.3
Le Rhône du ruisseau des Moulins inclus au Fouron,45.7778,5.4717,87.59,0.0,faible/nulle,fort,0-2,7145175.0,11,0.0
La Corrèze du confluent du [toponyme inconnu] au confluent du Brauze (inclus),45.2196,1.705,32.51,0.0,faible/nulle,faible,0-0,95445.2,1,0.0
Le Thus,44.2199,-0.1797,68.77,1.52,faible/nulle,fort,0-2,1118957.8,2,83.6
L'ODET DU JET (NC) AU STEIR (NC),48.0117,-4.0845,85.2,0.0,faible/nulle,fort,0-2,4735161.8,1,0.0
LA LOIRE DE L'AUTHION (NC) A LA MAINE (NC),47.4216,-0.5759,70.77,0.0,faible/nulle,fort,0-2,1276236.2,2,0.0
L'Aujon du confluent de la Dhuy (exclu) au confluent de la Renne (exclu),48.1163,4.9082,8.13,6.6,forte,faible,2-0,0.0,5,93.9
La Seine du confluent de la Sarce (exclu) au confluent de l'Hozain (exclu),48.1842,4.2167,98.42,0.0,faible/nulle,fort,0-2,870100650.4,6,0.0
LA VILAINE DE LA VEUVRE (NC) A L'ILLE (NC),48.1218,-1.6009,73.4,0.0,faible/nulle,fort,0-2,1517492.2,3,0.0
La Vézère du confluent de la Douime au confluent du Coly,45.1196,1.2309,8.13,0.0,faible/nulle,faible,0-0,0.0,0,0.0
LA VAUNOISE DU RAU DES MARES NOIRES (C) AU MEU (NC),48.1364,-1.8418,70.88,0.0,faible/nulle,fort,0-2,1282614.2,5,0.0
COTIERS DU GOYEN (NC) AU J410400 (NC),47.9964,-4.4674,58.65,0.0,faible/nulle,modere,0-1,567818.0,1,0.0
Le Maumont Blanc de sa source au confluent du Chauvignac (inclus),45.3006,1.629,44.63,0.0,faible/nulle,modere,0-1,235457.4,3,0.0
La Saône de sa source au ruisseau de l'étang de Belrupt inclus,48.1213,6.0668,49.99,0.0,faible/nulle,modere,0-1,339200.0,9,0.0
Le Coney de sa source au ruisseau des Auriers,48.1027,6.3685,59.01,0.0,faible/nulle,modere,0-1,579947.6,4,0.0
La Vanne de sa source au confluent de la Nosle (inclus),48.2419,3.8285,73.03,0.82,faible/nulle,fort,0-2,1482631.4,21,81.8
Le Lunain de sa source au confluent du Loing (exclu),48.2196,2.9393,71.59,1.79,faible/nulle,fort,0-2,1344390.0,17,84.6
LA LOIRE DU SORNIN (NC) A LA TEISSONNE (NC),46.1666,4.0987,8.13,0.0,faible/nulle,faible,0-0,0.0,0,0.0
L'Essonne du confluent de la Rimarde (exclu) au confluent de la Velvette (inclus),48.2391,2.4076,88.48,8.38,forte,fort,2-2,8372841.8,23,96.0
RAU DE COMPER & SES AFFLUENTS,48.0838,-2.1294,8.13,0.0,faible/nulle,faible,0-0,0.0,3,0.0
L'ODET DU STEIR (NC) A LA R DE L'ANSE DE SAINT CADOU (NC),47.9727,-4.1367,8.13,0.0,faible/nulle,faible,0-0,0.0,0,0.0
La Rimarde de sa source au confluent de l'Essonne (exclu),48.0892,2.3134,83.96,0.0,faible/nulle,fort,0-2,4080680.0,10,0.0
La Bourbre du ruisseau d'Enfer inclus au canal Mouturier inclus,45.5718,5.2921,86.64,14.17,forte,fort,2-2,6022823.2,8,98.7
Le Bouchot.,48.0236,6.8208,53.71,0.0,faible/nulle,modere,0-1,428201.2,3,0.0
La Garonne du confluent de la Tessonne au conflunet du Pantagnac (inclus),43.939,1.221,25.29,0.0,faible/nulle,faible,0-0,42816.4,1,0.0
Le Coney du ruisseau des Auriers au ruisseau Grandrupt,48.0677,6.2845,93.17,0.0,faible/nulle,fort,0-2,44315840.6,5,0.0
La Corrèze du confluent de la Corrèze de Pradines au confluent du Forgés (inclus),45.4241,1.9258,24.92,0.0,faible/nulle,faible,0-0,41303.2,1,0.0
La Vanne du confluent de l'Alain (exclu) au confluent de l'Yonne (exclu),48.1549,3.4866,91.24,0.0,faible/nulle,fort,0-2,18837612.6,15,0.0
L'Armançon du confluent du Créanton (exclu) au confluent de L'Yonne (exclu),48.0119,3.558,97.45,0.0,faible/nulle,fort,0-2,402828887.0,5,0.0
La Seine du confluent de l'Ource (exclu) au confluent de l'Arce (inclus),48.1136,4.5473,31.3,0.0,faible/nulle,faible,0-0,84718.2,10,0.0
La Maronne de sa source au confluent de l'Aspre (inclus),45.118,2.5649,28.41,0.0,faible/nulle,faible,0-0,62168.2,3,0.0
La Vanne du confluent de la Nosle (exclu) au confluent de l'Alain (inclus),48.2141,3.6205,89.43,0.0,faible/nulle,fort,0-2,10599324.0,17,0.0
La Seine du confluent de la Laignes (exclu) au confluent de l'Ource (exclu),48.0787,4.3614,45.18,0.0,faible/nulle,modere,0-1,242525.4,2,0.0
La Meuse du ruisseau du Grand-Etang au ruisseau des Noues (inclus).,48.054,5.5257,17.42,0.0,faible/nulle,faible,0-0,4075.0,6,0.0
Le Graviange,45.105,-0.282,8.13,0.0,faible/nulle,faible,0-0,0.0,1,0.0
LE MEU DE LA VAUNOISE (NC) A LA VILAINE (NC),48.0468,-1.8428,16.38,0.0,faible/nulle,faible,0-0,100.8,1,0.0
LE SCORFF DE LA R DE PONT-CALLECK (NC) AU RAU DE PONT ER BELLEC (C),47.9672,-3.2868,8.13,3.54,moderee,faible,1-0,0.0,1,89.1
LA VILAINE DE LA CANTACHE (NC) A LA VEUVRE (NC),48.0991,-1.3851,83.99,0.0,faible/nulle,fort,0-2,4091224.2,9,0.0
LA SARRE & SES AFFLUENTS,48.052,-3.1338,53.14,6.66,forte,modere,2-1,411885.2,5,94.0
LE SCORFF DE SA SOURCE A LA R DE PONT-CALLECK (NC),48.0565,-3.2404,26.84,0.0,faible/nulle,faible,0-0,51680.2,4,0.0
LA SEICHE DE L'YAIGNE (NC) A L'ISE (NC),48.036,-1.6135,8.13,0.0,faible/nulle,faible,0-0,0.0,1,0.0
La Bourbre du canal Mouturier au canal de Catelan,45.6056,5.1584,84.36,0.0,faible/nulle,fort,0-2,4281716.0,9,0.0
Le Rognon de sa source au confluent du Seuillon (inclus),48.0706,5.4248,54.76,0.0,faible/nulle,modere,0-1,454445.0,8,0.0
La Solane,45.3011,1.7573,49.22,0.0,faible/nulle,modere,0-1,321132.8,2,0.0
La Marne du confluent de la Suize (exclu) au confluent du ruisseau de Meures (exclu),48.145,5.1689,91.27,12.5,forte,fort,2-2,19211371.2,12,98.2
La Renne de sa source au confluent de l'Aujon (exclu),48.1345,4.9464,18.15,0.0,faible/nulle,faible,0-0,6807.4,7,0.0
Le Landion de sa source au confluent de l'Ource (exclu),48.0458,4.6516,19.76,0.0,faible/nulle,faible,0-0,14170.0,1,0.0
Le Loing du confluent de la Cléry (exclu) au confluent du Fusain (exclu),48.1342,2.8929,79.93,2.22,faible/nulle,fort,0-2,2615056.6,15,85.9
L'Isère du Salin au ruisseau du Carré inclus,45.3257,5.9628,90.94,0.0,faible/nulle,fort,0-2,17642310.8,6,0.0
LA VILAINE DU MEU (NC) A LA SEICHE (NC),48.0084,-1.798,8.13,0.0,faible/nulle,faible,0-0,0.0,1,0.0
Le Saulière du confluent du Millet au confluent de la Luzège,45.3952,2.0929,22.02,0.0,faible/nulle,faible,0-0,25155.2,2,0.0
LA CONIE DU RAU LA CONIE (NC) AU LOIR (NC),48.1073,1.4357,79.92,0.0,faible/nulle,fort,0-2,2610224.4,5,0.0
LA SARTHE DE L'ORNE (NC) A L'ANTONNIERE (NC),48.094,0.2007,61.09,0.0,faible/nulle,modere,0-1,656899.0,4,0.0
La Fecht de sa source au ruisseau dit ''la Fecht'' (inclus).,47.9912,7.0514,61.22,0.0,faible/nulle,modere,0-1,661667.8,3,0.0
La Semouse de sa source au bras d'Aillevillers-et-Lyaumont,47.9907,6.3952,92.66,0.0,faible/nulle,fort,0-2,35236526.4,3,0.0
La Saône de la Mause incluse au ruisseau de la Sâle,48.0657,5.9531,38.21,0.0,faible/nulle,modere,0-1,154465.4,9,0.0
Le Galinat,44.9352,0.5424,8.13,4.72,moderee,faible,1-0,0.0,2,91.3
La Gimelle (Montane) du confluent du [toponyme inconnu] au confluent de la Saint Bonnette,45.2691,1.7985,8.13,0.0,faible/nulle,faible,0-0,0.0,0,0.0
La Marne du confluent de la Traire (exclu) au confluent de la Suize (exclu),48.0743,5.2291,87.43,0.0,faible/nulle,fort,0-2,6951807.4,6,0.0
La Gimelle (Montane) du confluent du Rouget au confluent du [toponyme inconnu] (inclus),45.3042,1.8726,24.62,0.0,faible/nulle,faible,0-0,39013.0,2,0.0
L'Armance de sa source au confluent du Landion (exclu),48.0863,4.0469,33.16,0.0,faible/nulle,faible,0-0,100959.0,10,0.0
L'Adour du confluent du Saget au confluent du grand Lées,43.6994,-0.1728,80.01,1.64,faible/nulle,fort,0-2,2644731.8,6,83.9
L'Yonne du confluent du ru Galant (exclu) au confluent de la Vanne (exclu),48.0966,3.342,78.8,1.62,faible/nulle,fort,0-2,2363521.6,16,83.8
La Cuze,44.8735,1.2089,63.82,0.0,faible/nulle,modere,0-1,799678.0,1,0.0
LE LOIR DE LA CONIE (NC) A L'YERRE (NC),48.0849,1.2843,74.03,2.52,faible/nulle,fort,0-2,1584837.0,3,86.7
LA SEICHE DE LA QUINCAMPOIX (NC) A L'YAIGNE (NC),48.0023,-1.5161,33.9,0.0,faible/nulle,modere,0-1,107046.0,3,0.0
La Saint Bonnette du confluent de la Gimelle (Montane) au confluent de la Corrèze,45.2471,1.7674,8.13,0.0,faible/nulle,faible,0-0,0.0,0,0.0
La Saône du Coney à la Vieille,47.8831,5.9391,94.85,0.0,faible/nulle,fort,0-2,108955009.0,5,0.0
L'Auvézère du confluent de la Lourde au confluent du Blâme,45.253,1.0598,56.75,0.0,faible/nulle,modere,0-1,508344.0,5,0.0
Le Coney du ruisseau Grandrupt inclus au ruisseau de la Fresse inclus,48.0063,6.2413,95.62,1.57,faible/nulle,fort,0-2,158803149.2,7,83.7
La Maronne du confluent du Riou Tort au confluent de la bedaine,45.051,2.1498,25.66,0.0,faible/nulle,faible,0-0,45079.0,1,0.0
Le Ventron.,47.9384,6.8699,27.74,0.0,faible/nulle,faible,0-0,56893.6,1,0.0
La Doller du Seebach au Villerbach (inclus).,47.7991,6.9686,28.57,0.0,faible/nulle,faible,0-0,63161.2,3,0.0
La Saône du ruisseau de la Sâle incluse à l'Apance,48.0255,5.8595,48.02,0.0,faible/nulle,modere,0-1,295138.0,14,0.0
La Seine du confluent du ruisseau des Hâtes (exclu) au confluent de la Laignes (exclu),48.0164,4.4545,98.47,0.0,faible/nulle,fort,0-2,875745098.0,5,0.0
Le Créanton de sa source au confluent de l'Armanèon (exclu),48.0514,3.6767,71.68,0.0,faible/nulle,fort,0-2,1351089.4,5,0.0
Le Petit Fusain de sa source au confluent du Fusain (exclu),48.0468,2.5983,78.88,0.0,faible/nulle,fort,0-2,2374073.2,8,0.0
L'Ill de la Thur à la Lauch (ou Vieille Thur).,47.9724,7.3815,85.22,0.0,faible/nulle,fort,0-2,4752770.0,2,0.0
La Dordogne du confluent du Labiou au confluent du Pont Aubert,45.2809,2.2524,25.27,0.0,faible/nulle,faible,0-0,42759.6,2,0.0
LE NINIAN DE L'YVEL (NC) A L'OUST (NC),47.9127,-2.3959,77.31,0.0,faible/nulle,fort,0-2,2049733.8,1,0.0
Le Moron du confluent du Colinet au confluent du Bourdillot (inclus),45.0957,-0.519,53.95,0.0,faible/nulle,modere,0-1,436838.6,3,0.0
LA SEICHE DE SA SOURCE A L'ARDENNE (NC),47.9797,-1.1782,37.44,0.0,faible/nulle,modere,0-1,145632.8,11,0.0
LE NINIAN DU LEVERIN (NC) A L'YVEL (NC),47.9402,-2.4684,8.13,0.0,faible/nulle,faible,0-0,0.0,1,0.0
Le ruisseau du Vaunoy de sa source au confluent de la Touques (exclu),49.3071,0.0617,58.91,0.0,faible/nulle,modere,0-1,575117.2,4,0.0
Le Coney du ruisseau de la Fresse à la Saône,47.9637,6.0751,96.27,0.0,faible/nulle,fort,0-2,207058145.6,12,0.0
La Marne du confluent du ruisseau du Val de Gris (exclu) au confluent de la Traire (exclu),47.9778,5.268,91.45,0.0,faible/nulle,fort,0-2,20327402.2,3,0.0
La Cléry de sa source au confluent du Loing (exclu),48.0583,2.9744,82.94,2.64,moderee,fort,1-2,3595487.0,13,87.0
La Dordogne du confluent du Barailler au confluent du Seignal,44.8748,0.2496,35.08,0.0,faible/nulle,modere,0-1,119860.8,1,0.0
La Traire de sa source au confluent de la Marne (exclu),47.998,5.3841,36.53,0.0,faible/nulle,modere,0-1,135740.0,10,0.0
L'Aube du confluent du Coupe Charme (exclu) au confluent de l'Aujon (exclu),48.0456,4.788,53.29,0.0,faible/nulle,modere,0-1,416702.0,11,0.0
Le Loing du confluent de la Bezonde (exclu) au confluent de la Cléry (exclu),48.0392,2.8172,91.89,0.0,faible/nulle,fort,0-2,25425576.8,6,0.0
La Bezonde du confluent du Limetin (exclu) au confluent du Loing (exclu),48.0235,2.6952,81.26,0.0,faible/nulle,fort,0-2,3048141.4,1,0.0
L'Hozain de sa source au confluent du ru d'Erlant (exclu),48.0299,4.2046,31.67,0.0,faible/nulle,faible,0-0,87478.2,6,0.0
Le Manoire de sa source au confluent du Saint-Geyrac,45.1288,0.9327,27.97,1.88,faible/nulle,faible,0-0,59298.0,2,84.9
L'HUISNE DE LA VIVE PARENCE (NC) A LA SARTHE (NC),48.0012,0.2738,90.76,1.92,faible/nulle,fort,0-2,15816114.0,4,85.0
L'OUST DU SEDON (NC) AU NINIAN (NC),47.9105,-2.4892,57.25,0.0,faible/nulle,modere,0-1,524286.6,2,0.0
La Saône de l'Apance au Coney,47.9399,5.9433,24.54,0.0,faible/nulle,faible,0-0,38777.8,5,0.0
l'Herbasse du ruisseau de la Combe du Pertuis à l'Isère,45.104,4.9557,46.57,0.0,faible/nulle,modere,0-1,266394.4,1,0.0
L'Yonne du confluent du Ravillon (exclu) au confluent du Tholon (exclu),47.9809,3.4207,87.2,0.0,faible/nulle,fort,0-2,6590991.0,3,0.0
La Bezonde de sa source au confluent de l'Huillard (exclu),47.9932,2.5124,71.38,0.0,faible/nulle,fort,0-2,1322389.0,6,0.0
La Véore de sa source à l'Ecoutay inclus,44.8854,5.0762,89.14,2.19,faible/nulle,fort,0-2,9589891.8,13,85.7
L'Armançon du confluent de l'Armance (exclu) au confluent du Créanton (exclu),47.9687,3.6891,98.5,0.0,faible/nulle,fort,0-2,908040818.2,4,0.0
Le Lary du confluent du Palais au confluent de l'Isle,45.0925,-0.1698,72.66,0.0,faible/nulle,fort,0-2,1448637.8,4,0.0
Le ruisseau du Val de Gris de sa source au confluent de la Marne (exclu),47.9318,5.4129,56.78,0.0,faible/nulle,modere,0-1,510166.8,7,0.0
L'Apance,47.9725,5.7436,58.46,0.0,faible/nulle,modere,0-1,562907.6,8,0.0
L'OUSSANCE (K432030) DE SA SOURCE AU CANAL D'ORLEANS (NC),47.9968,2.2076,41.11,0.0,faible/nulle,modere,0-1,186520.2,2,0.0
La Thur du Mordfeldfoch au Wissbach (Altenbachrunz) (inclus).,47.8595,7.0638,43.61,0.0,faible/nulle,modere,0-1,219822.8,5,0.0
Le Mühlbach de la Hardt depuis son origine sur le canal de la Hardt jusqu'au Thierbachgraben.,47.8956,7.5536,71.26,0.0,faible/nulle,fort,0-2,1315055.6,1,0.0
La Lanterne du Breuchin à la Semouse,47.8377,6.327,40.49,0.0,faible/nulle,modere,0-1,177771.8,7,0.0
Le Landion de sa source au confluent de l'Armance (exclu),47.9894,4.0828,51.46,0.82,faible/nulle,modere,0-1,375399.0,11,81.8
La Combeauté,47.9125,6.4522,93.99,0.0,faible/nulle,fort,0-2,64959524.8,4,0.0
La Semouse de la Combeauté à la Lanterne,47.8908,6.203,8.13,0.0,faible/nulle,faible,0-0,0.0,11,0.0
La Semouse du confluent du bras d'Aillevillers-et-Lyaumont à la Combeauté,47.9484,6.404,89.64,0.0,faible/nulle,fort,0-2,11294171.4,6,0.0
La Boutonne du confluent de la Trézence (inclus) au confluent du  [toponyme inconnu] (inclus),45.9986,-0.6014,28.32,0.0,faible/nulle,faible,0-0,61804.0,3,0.0
La Sarce de sa source au confluent de la Seine (exclu),48.0143,4.2787,95.93,0.0,faible/nulle,fort,0-2,183690589.2,11,0.0
Le ruisseau de Neuwiller (de sa source à la frontière franco-suisse).,47.5198,7.5078,25.0,0.0,faible/nulle,faible,0-0,41384.2,1,0.0
L'Armance du confluent du Landion (exclu) au confluent de l'Armanèon (exclu),48.0145,3.9311,67.09,1.73,faible/nulle,fort,0-2,989083.2,21,84.4
La petite Amance,47.9066,5.6381,27.92,5.6,moderee,faible,1-0,58948.6,11,92.5
LA SARTHE DE LA VAIGE (NC) A LA TAUDE (NC),47.8247,-0.3459,8.13,0.0,faible/nulle,faible,0-0,0.0,0,0.0
L'Aube du confluent du Longereau (exclu) au confluent de l'Aubette (exclu),47.8999,4.954,26.89,0.0,faible/nulle,faible,0-0,51840.8,3,0.0
Le Leimbach à l'amont du confluent du Dollerbaechlein.,47.7696,7.1839,86.61,0.0,faible/nulle,fort,0-2,5961898.2,1,0.0
LE CANAL D'ORLEANS JUSQU'A L'OUSSANCE (K433030) (NC),47.9462,2.2643,68.43,0.0,faible/nulle,fort,0-2,1103129.6,4,0.0
La Croutelle,45.7961,0.5609,19.13,0.0,faible/nulle,faible,0-0,11105.4,1,0.0
L'AFF DE L'OYON (NC) AU COMBS (NC),47.8618,-2.0945,20.34,18.64,forte,faible,2-0,17064.8,1,99.3
L'OUSSANCE (K433030) DU CANAL D'ORLEANS A LA LOIRE (NC),47.9175,2.0925,81.29,0.0,faible/nulle,fort,0-2,3058019.4,5,0.0
Le Breuchin,47.8556,6.5368,95.19,0.0,faible/nulle,fort,0-2,130281377.8,17,0.0
L'ERVE DU TREULON (NC) A LA SARTHE (NC),47.8801,-0.3363,44.93,0.0,faible/nulle,modere,0-1,238923.8,1,0.0
Le canal de la Daurade,45.992,-0.858,39.78,0.0,faible/nulle,modere,0-1,170982.0,5,0.0
L'OUDON DE LA MEE (NC) A L'USURE (NC),47.8611,-0.9304,43.33,0.0,faible/nulle,modere,0-1,217155.0,2,0.0
La Saône de la Vieille incluse au canal du moulin inclus (zones U020 à U022 exclues),47.8684,5.8455,37.11,0.0,faible/nulle,modere,0-1,142329.4,10,0.0
La Dordogne du confluent des Firgues au confluent de la Glane de Servières,45.1744,2.0309,23.09,0.0,faible/nulle,faible,0-0,30769.2,1,0.0
LA SARTHE DE LA VEGRE (NC) A L'ERVE (NC),47.873,-0.291,55.15,0.0,faible/nulle,modere,0-1,463679.0,2,0.0
La Durèze,44.7631,0.0701,36.76,0.0,faible/nulle,modere,0-1,138188.4,5,0.0
LE SEMNON DU RAU DE MAIGE (NC) A LA VILAINE (NC),47.8785,-1.6925,36.02,0.0,faible/nulle,modere,0-1,130150.6,3,0.0
La Suize de sa source au confluent de la Marne (exclu),47.964,5.1549,91.06,0.0,faible/nulle,fort,0-2,18225186.0,14,0.0
L'Huillard de sa source au confluent de la Bezonde (exclu),47.9292,2.4535,70.19,1.06,faible/nulle,fort,0-2,1216892.8,9,82.3
L'Ouche du Suzon à la Saône,47.1995,5.2089,92.08,0.0,faible/nulle,fort,0-2,27148597.4,7,0.0
L'Amance de la petite Amance au ruisseau de la Gueuse,47.8302,5.7158,21.55,0.0,faible/nulle,faible,0-0,23108.8,11,0.0
La Truyère du confluent du Lebot au confluent du Brezons,44.8994,2.8334,40.57,0.0,faible/nulle,modere,0-1,178404.6,2,0.0
L'Alte-Bach,47.5994,7.4527,82.11,0.0,faible/nulle,fort,0-2,3308477.2,10,0.0
La Laignes du confluent du ruisseau de Marcenay (exclu) au confluent du ruisseau du Val Dupuis (exclu),47.8733,4.3274,32.23,0.0,faible/nulle,faible,0-0,93283.6,6,0.0
La Gourgeonne,47.6944,5.7978,44.06,9.39,forte,modere,2-1,224572.4,15,96.7
L'Aubette de sa source au confluent de l'Aube (exclu),47.8484,4.9219,22.6,0.0,faible/nulle,faible,0-0,27932.6,6,0.0
L'AFF DU COMBS (NC) AU RAHUN (NC),47.8003,-2.0514,28.53,0.0,faible/nulle,faible,0-0,62906.8,2,0.0
LE TER (J580410) DE SA SOURCE A LA MER,47.7487,-3.4035,21.99,0.0,faible/nulle,faible,0-0,25086.8,1,0.0
La Drôme de sa source au torrent de Nière Gourzine inclus,44.5463,5.5536,49.67,0.0,faible/nulle,modere,0-1,332405.0,8,0.0
L'Ognon de sa source au Fourchon,47.8095,6.6772,91.0,0.0,faible/nulle,fort,0-2,18071041.6,8,0.0
La Douze du confluent de l'Argelouse au confluent du Nouët,43.9937,-0.2158,52.74,1.32,faible/nulle,modere,0-1,401507.4,1,83.1
