nom_bassin_versant,latitude_centroide,longitude_centroide,quantile_prelevement_national,score_secheresse,classe_secheresse,classe_prelevement,classe_bivariee,volume_moyen_preleve_m3_an,nb_communes,rang_secheresse_national
Le Lemboulas de sa source au confluent du Cau,44.3033,1.5248,48.31,6.03,moderee,modere,1-1,299969.8,3,93.1
Le Tarn du confluent du Valat de la Combe au confluent de la Barthe (incluse),44.3062,3.3938,8.13,9.49,forte,faible,2-0,0.0,1,96.7
L'Aveyron du confluent de l'Aubugues au confluent de la Serène,44.2271,1.989,17.03,0.0,faible/nulle,faible,0-0,2746.0,1,0.0
Le Tarn du confluent de la Barthe au confluent du [toponyme inconnu] (inclus),44.2956,3.2655,50.49,0.0,faible/nulle,modere,0-1,353620.8,2,0.0
Le Lausset du confluent du Hauga (inclus) au confluent du Gave d'Oloron,43.3038,-0.8128,40.35,0.0,faible/nulle,modere,0-1,176679.0,7,0.0
La Mimente du confluent du Malzac au confluent du Tarnon,44.2929,3.6641,38.84,0.0,faible/nulle,modere,0-1,161435.8,3,0.0
La Joyeuse du confluent du Saint-Martin au confluent de la Bidouze,43.3118,-1.0746,22.39,0.0,faible/nulle,faible,0-0,27332.0,4,0.0
L'Aveyron de sa source au confluent du Merdans,44.3314,3.1037,8.13,0.0,faible/nulle,faible,0-0,0.0,1,0.0
Le Tarnon du confluent du Fraissinet au confluent de la Mimente,44.2605,3.5959,27.44,0.0,faible/nulle,faible,0-0,55105.2,1,0.0
Le Viaur du confluent du Bouzou (inclus) au confluent du Cadousse,44.307,2.8078,8.13,0.0,faible/nulle,faible,0-0,0.0,2,0.0
La Baïse du confluent du Cahuzat au confluent de la Garonne,44.2372,0.2833,70.06,0.0,faible/nulle,fort,0-2,1207525.2,5,0.0
L'Aveyron du confluent du Millets au confluent de l'Aubugues,44.2965,1.9661,59.4,0.0,faible/nulle,modere,0-1,592518.0,6,0.0
Le Ciron du confluent du Labarthe (Barthos) au confluent du Lep (Gouaneyre) (inclus),44.3072,-0.2606,78.77,0.0,faible/nulle,fort,0-2,2357825.0,3,0.0
La Masse de Prayssas (Rozéri),44.2881,0.5311,73.99,0.94,faible/nulle,fort,0-2,1582586.4,6,82.1
Le Viaur du confluent du Cadousse (inclus) au confluent du Vioulou,44.2701,2.7359,31.91,0.0,faible/nulle,faible,0-0,89218.8,2,0.0
Le Viaur de sa source au confluent du Bouzou,44.2641,2.9158,28.5,0.0,faible/nulle,faible,0-0,62705.2,2,0.0
La petite Leyre du confluent du Lagaraille au confluent du Calesèque (inclus),44.2577,-0.4431,74.73,0.0,faible/nulle,fort,0-2,1661024.4,1,0.0
La Mimente de sa source au confluent du Malzac (inclus),44.2669,3.7238,19.65,5.99,moderee,faible,1-0,13622.4,1,93.1
La petite Leyre du confluent du Calesèque au confluent de l'Ayguemorte,44.3005,-0.5666,8.13,3.89,moderee,faible,1-0,0.0,0,89.8
Le Bouret du confluent du Cousturé au confluent du canal de Ceinture (Boudigau),43.656,-1.3844,83.44,0.0,faible/nulle,fort,0-2,3814246.6,3,0.0
Le Rhône de la dérivation de Donzère-Mondragon à la dérivation de Caderousse,44.2127,4.7218,99.95,0.0,faible/nulle,fort,0-2,32909005996.0,4,0.0
Le Brana,44.2693,-0.6508,8.13,0.23,faible/nulle,faible,0-0,0.0,0,80.3
Le Canteloup de sa source au confluent de la barade de Mayon (inclus),44.2178,-0.952,86.93,0.0,faible/nulle,fort,0-2,6372608.6,2,0.0
Le Vioulou du confluent du Roucan au confluent du Viaur,44.2306,2.6889,8.13,0.0,faible/nulle,faible,0-0,0.0,1,0.0
L'Ouvèze du ruisseau d'Aygue Marce inclus au Lauzon de Puymeras,44.2397,5.165,80.27,0.0,faible/nulle,fort,0-2,2712971.4,9,0.0
Le Tarn du confluent du [toponyme inconnu] au confluent de la Jonte,44.2549,3.2152,8.13,0.0,faible/nulle,faible,0-0,0.0,0,0.0
La Bléone de sa source à l'Arigéol,44.2028,6.4644,45.23,0.0,faible/nulle,modere,0-1,242805.8,1,0.0
La Méouge,44.2267,5.6386,67.04,7.35,forte,fort,2-2,986517.6,13,94.9
Le Bourg,44.2652,3.1376,19.28,0.0,faible/nulle,faible,0-0,11919.2,1,0.0
Le Lézert de sa source au confluent du Lieux,44.2592,2.3544,32.82,0.0,faible/nulle,faible,0-0,98060.2,4,0.0
Le Rayet,44.2519,2.1848,28.89,0.0,faible/nulle,faible,0-0,65052.0,4,0.0
Le courant de Contis du confluent de la Coste-Heince au confluent du Courlis,44.0302,-1.2109,27.29,0.0,faible/nulle,faible,0-0,53479.4,1,0.0
La Leyre du confluent de la craste de Toulouse au confluent du Calède,44.2035,-0.7286,86.82,2.77,moderee,fort,1-2,6280356.2,2,87.4
Le courant de Mimizan du confluent du Capit à l'océan,44.1837,-1.2493,89.5,0.0,faible/nulle,fort,0-2,10810960.4,2,0.0
La petite Barguelonne,44.3103,1.2226,68.19,6.18,moderee,fort,1-2,1077419.8,12,93.3
La petite Séoune,44.2873,0.9176,82.6,8.23,forte,fort,2-2,3476229.2,10,95.8
Le Jabron,44.1627,5.7684,71.19,6.51,forte,fort,2-2,1307949.0,7,93.8
Le Viaur du confluent de la Cantarane (incluse) au confluent de la Nauze,44.2139,2.5334,32.85,10.65,forte,faible,2-0,98161.0,3,97.5
Le Toulourenc,44.1948,5.3566,44.14,0.0,faible/nulle,modere,0-1,225451.6,7,0.0
Le Lézert du confluent du Lieux au confluent du Viaur,44.2263,2.2532,19.21,0.0,faible/nulle,faible,0-0,11621.8,3,0.0
Le Verdon de la Lance incluse au Riou du Trou,44.1565,6.617,60.61,2.56,moderee,modere,1-1,637397.2,3,86.8
La Durance du Jabron au Vançon,44.1786,5.9938,99.27,0.0,faible/nulle,fort,0-2,2624444740.8,4,0.0
L'Arros du confluent de l'Arrêt-Darré au confluent de l'Arranche (incluse),43.2417,0.2571,59.86,0.0,faible/nulle,modere,0-1,611140.2,7,0.0
La Jonte du confluent du Béthuzon au confluent du Tarn,44.216,3.3642,23.93,2.99,moderee,faible,1-0,35161.4,5,87.9
L'Adour du confluent du [toponyme inconnu] (inclus) au confluent de la Midouze,43.7925,-0.7799,44.87,0.7,faible/nulle,modere,0-1,238207.6,1,81.2
La Serène du confluent de la Serène de Vabre au confluent de l'Aveyron,44.2224,2.0427,30.26,0.0,faible/nulle,faible,0-0,75983.2,1,0.0
La Bonnette,44.2632,1.7957,57.78,1.67,faible/nulle,modere,0-1,542627.0,8,84.1
La Lère Morte du confluent du Sietges au confluent du Candé,44.2036,1.6478,30.63,2.78,moderee,faible,1-0,79231.2,5,87.5
La Lèze du confluent de la Rijolle au confluent du Guillot (inclus),43.3107,1.3432,45.27,0.0,faible/nulle,modere,0-1,243230.0,2,0.0
Le Candé,44.2369,1.5679,56.02,0.0,faible/nulle,modere,0-1,489557.8,4,0.0
Le Lemboulas du confluent du Cau (inclus) au confluent du Petit Lembous,44.2314,1.4025,37.79,0.0,faible/nulle,modere,0-1,149118.2,2,0.0
L'Avance de sa source au confluent de la Bretagne (incluse),44.2348,0.0839,80.82,0.0,faible/nulle,fort,0-2,2911256.4,8,0.0
L'Escource de sa source au confluent du Brana (inclus),44.16,-0.9885,89.95,4.01,moderee,fort,1-2,12402993.0,2,89.9
Le Saint Barthélémy,44.2462,1.3458,67.7,5.88,moderee,fort,1-2,1029663.2,4,92.9
La Baïse du confluent de la Gélise au confluent du Cahuzat (inclus),44.185,0.3272,62.38,0.0,faible/nulle,modere,0-1,725917.2,3,0.0
La Garonne du confluent de la Seynes (incluse) au confluent du Mestré Pont (inclus),44.2448,0.5701,79.85,1.76,faible/nulle,fort,0-2,2578912.0,8,84.4
L'Auvignon du confluent du petit Auvignon au confluent de la Garonne,44.192,0.4137,79.98,0.0,faible/nulle,fort,0-2,2629191.0,4,0.0
La frange côtière de l'embouchure du courant de Sainte-Eulalie à l'embouchure du courant de Contis,44.1456,-1.2838,8.13,0.0,faible/nulle,faible,0-0,0.0,0,0.0
Le Lumansonesque,44.1974,3.0508,46.6,0.0,faible/nulle,modere,0-1,266835.8,3,0.0
Le Tarnon de sa source au confluent du Trépaloup,44.1493,3.6143,17.5,0.0,faible/nulle,faible,0-0,4389.6,1,0.0
Le Vioulou de sa source au confluent des Bèdettes (inclus),44.2002,2.8808,75.96,0.0,faible/nulle,fort,0-2,1844434.0,1,0.0
Le Tarnon du confluent du Trépaloup (inclus) au confluent du Fraissinet (inclus),44.1869,3.5739,22.67,0.0,faible/nulle,faible,0-0,28577.6,2,0.0
La Jonte de sa source au confluent de la Brèze,44.1813,3.498,38.68,0.0,faible/nulle,modere,0-1,159627.4,1,0.0
Le Vioulou du confluent des Bèdettes au confluent du Roucan (inclus),44.1964,2.7862,23.51,0.0,faible/nulle,faible,0-0,33157.2,1,0.0
Le Céor du confluent du Lagast (inclus) au confluent du Glandou,44.1773,2.5934,8.13,0.0,faible/nulle,faible,0-0,0.0,1,0.0
Le Céor du confluent du Glandou (inclus) au confluent du Giffou,44.1491,2.4952,8.13,0.0,faible/nulle,faible,0-0,0.0,3,0.0
Le Viaur du confluent de la Nauze au confluent du Céor,44.1966,2.4097,26.19,0.0,faible/nulle,faible,0-0,47580.2,1,0.0
Le Viaur du confluent du Rayet au confluent du Candour,44.1795,2.0812,29.07,2.04,faible/nulle,faible,0-0,66418.6,3,85.3
L'Aveyron du confluent du Viaur au confluent du Cérou,44.1848,1.9208,54.63,8.16,forte,modere,2-1,452020.2,5,95.8
La Gélise du confluent de l'Osse au confluent de la Baïse,44.1615,0.2502,60.16,0.0,faible/nulle,modere,0-1,617488.0,2,0.0
Le Petit Lembous,44.1831,1.411,41.62,10.36,forte,modere,2-1,193299.4,2,97.3
Le Ciron de sa source au confluent de l'Allons (inclus),44.1473,-0.0254,81.37,1.29,faible/nulle,fort,0-2,3076393.0,2,82.9
La Leyre du confluent de la barade du Daix au confluent de la craste de Toulouse (incluse),44.1552,-0.746,86.36,0.0,faible/nulle,fort,0-2,5590752.0,1,0.0
La Garonne du confluent de la Masse d'Agen (incluse) au confluent de la Seynes,44.2176,0.6375,77.93,1.3,faible/nulle,fort,0-2,2180874.2,11,83.0
L'Aigue du grand Rieu inclus à la dérivation de Caderousse,44.2027,4.8184,88.11,1.93,faible/nulle,fort,0-2,7999632.2,8,85.0
L'Issole de sa source à l'Encure,44.1078,6.4888,51.35,0.0,faible/nulle,modere,0-1,373897.6,1,0.0
La Duyes,44.1339,6.1218,52.45,0.0,faible/nulle,modere,0-1,393646.8,5,0.0
La Durance du Vançon à la Bléone,44.1035,6.0106,95.52,0.0,faible/nulle,fort,0-2,151988531.6,3,0.0
Le Tarn du confluent du Tescou au confluent de l'Aveyron,44.0139,1.3058,89.76,22.64,forte,fort,2-2,11609897.6,5,99.6
Le Viaur du confluent du Lieux (inclus) au confluent du Lézert,44.1613,2.2814,55.71,0.0,faible/nulle,modere,0-1,480435.2,3,0.0
Le Candour,44.137,2.0761,8.13,4.61,moderee,faible,1-0,0.0,1,91.0
La Lère Morte du confluent du Candé au confluent de l'Aveyron,44.1532,1.5297,69.95,5.8,moderee,fort,1-2,1200562.2,6,92.8
L'Estrigon du confluent du Bernin (inclus) au confluent du Biensang,44.1116,-0.5688,84.55,0.0,faible/nulle,fort,0-2,4376080.4,2,0.0
Le Lemboulas du confluent du Saint Barthélémy au confluent du Tarn,44.1669,1.2252,73.13,5.34,moderee,fort,1-2,1495385.8,2,92.2
La Barguelonne du confluent de la petite Barguelonne via le canal de Golfech au confluent de la Garonne,44.1626,0.9636,95.86,2.47,faible/nulle,fort,0-2,178316360.0,7,86.6
La Garonne du confluent de la Barguelonne au confluent de l'Auroue,44.1521,0.8386,38.15,0.24,faible/nulle,modere,0-1,153308.6,3,80.4
La Garonne du confluent du Gers au confluent de la Masse d'Agen,44.1613,0.6311,86.9,0.0,faible/nulle,fort,0-2,6351057.0,4,0.0
La Gouaneyre de sa source au confluent du Pécousin,44.1303,-0.4054,85.6,2.17,faible/nulle,fort,0-2,4999824.8,2,85.6
Le courant de Contis du confluent du Barrot à l'océan,44.0874,-1.273,65.63,0.0,faible/nulle,modere,0-1,895558.8,1,0.0
La Durance de la Bléone au Beuvon inclus,44.0493,5.952,50.36,3.74,moderee,modere,1-1,350737.8,4,89.5
La Mède,44.1308,5.1038,80.84,5.45,moderee,fort,1-2,2920315.4,14,92.3
L'Ouvèze du canal de Carpentras inclus à la Sorgue de Velleron,44.1079,4.9262,8.13,0.0,faible/nulle,faible,0-0,0.0,0,0.0
La grande Levadé,44.0735,4.9538,64.71,0.0,faible/nulle,modere,0-1,843969.8,1,0.0
La Muze du confluent de l'Estalane au confluent du Tarn,44.1307,2.946,30.1,3.7,moderee,faible,1-0,74769.2,2,89.4
La Dourbie du confluent de la Garène au confluent du Riou Sec (inclus),44.138,3.2593,71.77,0.0,faible/nulle,fort,0-2,1364836.6,2,0.0
Le courant de Messanges,43.8205,-1.3778,74.1,0.0,faible/nulle,fort,0-2,1586813.2,3,0.0
Le Coudols,44.1173,2.793,17.51,0.0,faible/nulle,faible,0-0,4449.8,1,0.0
Le Viaur du confluent du Céor au confluent du Lieux,44.1152,2.3245,50.43,1.14,faible/nulle,modere,0-1,352197.8,3,82.5
Le Céret,44.101,2.1984,78.15,0.0,faible/nulle,fort,0-2,2227283.4,5,0.0
Le Tarn du confluent du Lemboulas au confluent de la Larone,44.1399,1.1143,79.95,0.0,faible/nulle,fort,0-2,2619922.4,2,0.0
L'Aveyron du confluent du Cérou au confluent de la Bonnette,44.1755,1.83,37.86,8.54,forte,modere,2-1,149837.6,6,96.2
Le Rieumet,44.1177,1.624,51.28,8.38,forte,modere,2-1,373244.0,3,96.0
La Leyre de sa source au confluent de la barade du Daix (incluse),44.0997,-0.7791,75.28,1.4,faible/nulle,fort,0-2,1738638.0,1,83.2
L'Issole de l'Encure incluse au Verdon,44.0321,6.476,41.23,0.0,faible/nulle,modere,0-1,187751.0,2,0.0
Le Var du ravin de Chaudan inclus au Coulomp,44.0172,6.7818,43.71,0.0,faible/nulle,modere,0-1,220481.8,3,0.0
L'Adour du confluent du Louet au confluent de l'Arros,43.624,-0.0126,67.47,0.0,faible/nulle,fort,0-2,1014844.6,3,0.0
La Nesque de sa source au vallat de Saume Morte inclus,44.085,5.4437,51.27,3.77,moderee,modere,1-1,372886.8,5,89.5
L'Auzon,44.0648,5.1727,70.37,0.0,faible/nulle,fort,0-2,1237100.4,7,0.0
La Bléone du Bès à la Duyes,44.0606,6.2092,90.37,2.55,moderee,fort,1-2,13862355.0,7,86.8
La Bléone de la Duyes à la Durance,44.0357,6.0544,86.86,0.0,faible/nulle,fort,0-2,6334284.2,1,0.0
L'Aveyron du confluent de le Vère au confluent du Rieumet,44.0524,1.6378,76.02,0.0,faible/nulle,fort,0-2,1853377.4,2,0.0
La Dourbie du confluent du Riou Sec au confluent du Tarn,44.1085,3.1608,53.43,0.0,faible/nulle,modere,0-1,420478.8,1,0.0
Le Trèvezel du confluent du Bonheur au confluent de la Dourbie,44.0882,3.3794,18.03,0.0,faible/nulle,faible,0-0,6336.4,2,0.0
La Dourbie de sa source au confluent du Valat des Gardies (inclus),44.0606,3.5357,8.13,0.0,faible/nulle,faible,0-0,0.0,0,0.0
La Garonne du confluent de la Sère au confluent du Tarn,44.0618,1.0606,8.13,0.0,faible/nulle,faible,0-0,0.0,0,0.0
Le Tarn du confluent de la Dourbie au confluent du Cernon,44.0932,3.0431,36.94,1.54,faible/nulle,modere,0-1,140597.4,1,83.6
Le Canal Seudre-Charente,45.8785,-0.9458,8.13,0.0,faible/nulle,faible,0-0,0.0,0,0.0
La Garonne du confluent de l'Arrats au confluent de la Barguelonne,44.0781,0.8231,8.13,0.0,faible/nulle,faible,0-0,0.0,0,0.0
L'Alrance de sa source au confluent du Bétouille (inclus),44.1116,2.6987,24.83,0.0,faible/nulle,faible,0-0,40767.2,2,0.0
La Garonne du confluent de l'Ayroux au confluent de l'Arrats,44.0987,0.9459,87.56,0.0,faible/nulle,fort,0-2,7076403.6,7,0.0
La Garonne du confluent de l'Auroue au confluent de la Séoune,44.1095,0.7118,64.29,0.0,faible/nulle,modere,0-1,823639.8,7,0.0
L'Osse du confluent du Paquet (inclus) au confluent de la Gélise,44.0715,0.3034,8.13,4.0,moderee,faible,1-0,0.0,0,89.9
Le Gers du confluent du Pradet au confluent de la Garonne,44.1008,0.6537,62.05,3.61,moderee,modere,1-1,709736.2,3,89.3
La Baïse du confluent du Drot au confluent de la Gélise,44.1073,0.3658,85.13,1.71,faible/nulle,fort,0-2,4685330.8,5,84.2
La Gélise du confluent de l'Auzoue au confluent de l'Osse,44.0886,0.2121,72.65,1.62,faible/nulle,fort,0-2,1448589.4,3,83.8
L'Estampon du confluent du Lugaut au confluent de la Douze,44.0646,-0.2893,55.18,3.22,moderee,modere,1-1,465008.0,1,88.4
La Gouaneyre du confluent du Pécousin (inclus) au confluent de la Douze,44.054,-0.4433,49.65,1.7,faible/nulle,modere,0-1,332214.6,2,84.2
La Dourbie du confluent du Valat des Gardies au confluent des Crozes (inclus),44.0507,3.4493,19.36,0.0,faible/nulle,faible,0-0,12452.8,1,0.0
Le Coulon de sa source au ravin de la Prée inclus,44.0515,5.6255,27.34,1.07,faible/nulle,faible,0-0,54197.4,2,82.4
Le Verdon de la Sasse incluse à l'Issole,43.9943,6.5679,44.85,0.0,faible/nulle,modere,0-1,237996.4,2,0.0
L'Aveyron du confluent du Rieumet au confluent du Longues Aygues (inclus),44.052,1.5685,87.74,13.06,forte,fort,2-2,7278862.8,3,98.4
Le Rhône de l'Aigue au bras d'Avignon,44.0714,4.747,99.89,5.33,moderee,fort,1-2,27456800960.2,8,92.1
La Dourbie du confluent du Trèvezel au confluent de la Garène,44.0668,3.2399,8.13,0.0,faible/nulle,faible,0-0,0.0,1,0.0
Le Tarn du confluent du Prat Long au confluent du Coudols,44.0709,2.8343,20.94,0.0,faible/nulle,faible,0-0,20055.8,1,0.0
Le Giffou du confluent de la Durenque (incluse) au confluent du Cône,44.0861,2.5451,29.73,0.0,faible/nulle,faible,0-0,72333.8,1,0.0
L'Alrance du confluent du Bétouille au confluent du Tarn,44.037,2.666,72.6,0.0,faible/nulle,fort,0-2,1440904.6,2,0.0
Le Cérou de sa source au confluent du Boutescure (inclus),44.0527,2.3955,45.74,2.72,moderee,modere,1-1,251863.8,5,87.2
Le Tarn du confluent de la Larone au confluent de la Garonne,44.0814,1.0879,86.33,0.0,faible/nulle,fort,0-2,5556506.6,1,0.0
Le Cérou du confluent du Boutescure au confluent du Céroc,44.0364,2.2814,35.77,0.0,faible/nulle,modere,0-1,128130.2,5,0.0
Le Tarn du confluent du Coudols au confluent du Dourdou (de Camarès),44.0352,2.7521,24.79,0.0,faible/nulle,faible,0-0,40472.8,4,0.0
Le Cérou du confluent du Céroc (inclus) au confluent du Céret,44.0505,2.1907,35.35,7.35,forte,modere,2-1,123126.0,5,94.9
Le Cérou du confluent du Céret au confluent de la Ratayrié,44.0668,2.0465,44.01,0.86,faible/nulle,modere,0-1,224194.4,8,81.8
Le Cérou du confluent de la Ratayrié au confluent de l'Aveyron,44.0902,1.9455,47.46,0.0,faible/nulle,modere,0-1,284201.8,13,0.0
Le Tarn du confluent de l'Aveyron au confluent du Lemboulas,44.0853,1.2293,83.49,0.0,faible/nulle,fort,0-2,3824598.2,3,0.0
L'Aveyron du confluent de la Tauge au confluent du Dagran,44.082,1.3714,63.92,0.0,faible/nulle,modere,0-1,806435.8,3,0.0
La Nesque du vallat de Saume Morte à la Sorgue de Velleron,44.0199,5.2062,68.61,3.25,moderee,fort,1-2,1111707.4,7,88.4
La Gélise du confluent de l'Izaute au confluent de l'Auzoue,44.0629,0.1286,69.82,6.39,forte,fort,2-2,1188041.2,5,93.5
L'Estampon du confluent de la Rombleur (incluse) au confluent du Vialote,44.0522,-0.1725,75.17,0.0,faible/nulle,fort,0-2,1728974.2,3,0.0
L'Asse de sa source à l'Asse de Blieux,44.0028,6.4174,67.39,0.0,faible/nulle,fort,0-2,1010706.0,5,0.0
L'Asse de l'Asse de Blieux à l'Estoublaisse,43.9852,6.2565,55.45,0.0,faible/nulle,modere,0-1,471732.2,4,0.0
Le Tarn du confluent de la Muze au confluent du Prat Long (inclus),44.0661,2.8966,34.14,0.63,faible/nulle,modere,0-1,109050.6,1,81.1
La Tauge,44.0207,1.486,83.62,0.0,faible/nulle,fort,0-2,3865221.4,4,0.0
Le Cernon du confluent du Soulzon au confluent du Tarn,44.0308,3.0729,44.18,0.0,faible/nulle,modere,0-1,226679.8,3,0.0
Le Tarn du confluent de l'Alrance au confluent du Jauret (inclus),44.0106,2.5881,8.13,0.0,faible/nulle,faible,0-0,0.0,1,0.0
La Vère du confluent du Colombier (inclus) au confluent de l'Aveyron,44.0046,1.7151,31.64,7.98,forte,faible,2-0,87331.0,2,95.6
La Vère de sa source au confluent du Bonnefon,44.007,2.0485,40.94,0.0,faible/nulle,modere,0-1,184315.6,6,0.0
L'Aveyron du confluent du Dagran (inclus) au confluent du Tarn,44.0545,1.3369,60.06,0.0,faible/nulle,modere,0-1,615065.4,2,0.0
La Garonne du confluent de la Gimone au confluent de la Sère,44.0112,1.129,78.78,9.43,forte,fort,2-2,2361635.6,3,96.7
Le petit Auvignon,44.0666,0.5063,66.39,1.94,faible/nulle,modere,0-1,943277.2,6,85.1
L'Estrigon du confluent du Tourtilla (inclus) au confluent du Luc Clabet,43.993,-0.5326,33.96,0.0,faible/nulle,modere,0-1,107463.2,1,0.0
Le courant de Contis de sa source au confluent de la Coste Heince (incluse),43.9788,-1.089,79.35,0.0,faible/nulle,fort,0-2,2462427.4,2,0.0
La Vère du confluent de la Vervère au confluent du Rô oriental,44.0152,1.8373,34.45,0.0,faible/nulle,modere,0-1,111948.8,5,0.0
Le Moulin de Trouche,43.995,2.4225,22.93,0.0,faible/nulle,faible,0-0,29914.6,2,0.0
Le Var de la Tinée à la Vésubie,43.8936,7.1941,23.3,0.0,faible/nulle,faible,0-0,32293.2,1,0.0
Le Geloux du confluent de la Toupierie au confluent de la Midouze,43.973,-0.6599,74.41,0.0,faible/nulle,fort,0-2,1623687.8,2,0.0
Le Var du Coulomp à la Roudoule,43.9327,6.8046,80.85,2.56,moderee,fort,1-2,2922191.6,2,86.8
Le Rancure,43.9546,6.0057,99.29,0.0,faible/nulle,fort,0-2,2785053556.8,3,0.0
La Durance du Beuvon au Lauzon,43.977,5.9255,98.04,0.0,faible/nulle,fort,0-2,614582457.8,3,0.0
Le Bès du confluent du Bès d'Arengosse au confluent du Suzan(inclus),43.9577,-0.7546,77.27,2.1,faible/nulle,fort,0-2,2043990.0,3,85.4
La Laye,44.016,5.7401,79.45,7.11,forte,fort,2-2,2474939.0,6,94.6
La Gimone du confluent du Baquès (inclus) au confluent de la Garonne,43.9678,1.105,71.43,6.59,forte,fort,2-2,1324081.8,4,93.9
L'Hérault de l'Arre à la Vis,43.9725,3.6804,92.75,0.0,faible/nulle,fort,0-2,36162862.6,2,0.0
Le Gaycre,43.9978,2.4773,18.99,0.0,faible/nulle,faible,0-0,10398.2,3,0.0
La Dourbie du confluent des Crozes au confluent du Brevinque (inclus),44.0054,3.3574,28.52,0.0,faible/nulle,faible,0-0,62901.6,1,0.0
La Sère du confluent de la Cézone au confluent du Rieutord (inclus),43.9712,0.9988,60.59,2.79,moderee,modere,1-1,637215.0,5,87.6
La Dourbie du confluent du Brevinque au confluent du Trèvezel,44.0017,3.2798,61.69,0.0,faible/nulle,modere,0-1,694868.6,1,0.0
Le Tarn du confluent du Jauret au confluent du Rance,43.9788,2.5298,22.38,3.34,moderee,faible,1-0,27280.2,2,88.6
La Midouze du confluent du Geloux au confluent du Batanès (Perdon),43.9145,-0.6633,8.13,0.0,faible/nulle,faible,0-0,0.0,0,0.0
Le Gers du confluent de l'Auchie au confluent du Pradet (inclus),44.0255,0.6027,58.99,0.0,faible/nulle,modere,0-1,579129.6,6,0.0
L'Estampon de sa source au confluent du Lange,44.0169,-0.0392,76.7,7.74,forte,fort,2-2,1981288.6,1,95.3
La frange côtière de l'embouchure du courant de Contis à l'étang de Léon,43.9863,-1.3334,72.24,0.0,faible/nulle,fort,0-2,1411254.2,1,0.0
Le Retjons de sa source au confluent de l'Herrès (inclus),43.9363,-0.9367,83.47,1.77,faible/nulle,fort,0-2,3822817.0,2,84.5
Le Verdon de l'Issole au barrage de Chaudanne inclus,43.9059,6.5471,38.86,0.0,faible/nulle,modere,0-1,161700.6,4,0.0
Le Saison de sa source au confluent de l'Olhadoko Erreka,43.0206,-0.9928,25.45,0.0,faible/nulle,faible,0-0,43933.4,1,0.0
L'Estoublaisse,43.9152,6.2552,41.8,2.12,faible/nulle,modere,0-1,196270.0,2,85.5
La Doa,43.9319,5.4772,42.03,0.0,faible/nulle,modere,0-1,198546.6,3,0.0
La Durance du Lauzon inclus à l'Asse,43.991,5.8416,53.85,7.8,forte,modere,2-1,431528.0,9,95.4
Le Coulon du ravin de la Prée au Grand Vallat inclus,44.0063,5.5783,25.84,0.0,faible/nulle,faible,0-0,46075.4,6,0.0
Le Cernon de sa source au confluent du Soulzon (inclus),43.9788,3.0595,47.79,0.0,faible/nulle,modere,0-1,290161.0,4,0.0
La Vère du confluent du Rô oriental au confluent du Colombier,43.9932,1.7707,32.59,0.0,faible/nulle,faible,0-0,96583.0,1,0.0
Le Tarn du confluent du Sarlan (inclus) au confluent du Caussels,43.9718,2.199,81.1,0.0,faible/nulle,fort,0-2,3004930.0,6,0.0
Le Tescounet,43.9641,1.6046,66.63,9.58,forte,modere,2-1,953511.4,4,96.9
L'Osse du confluent du Manipau au confluent du Paquet,43.9757,0.3014,69.88,0.0,faible/nulle,fort,0-2,1192896.6,4,0.0
La Gélise du confluent du Tréou au confluent de l'Izaute,43.9848,0.0471,79.67,0.51,faible/nulle,fort,0-2,2522624.8,5,80.8
La Douze du confluent du Joutan (inclus) au confluent de l'Argelouse,43.9615,-0.1612,66.51,2.27,faible/nulle,modere,0-1,948684.6,3,86.0
Le Frêche,43.9387,-0.2535,50.64,0.0,faible/nulle,modere,0-1,358014.6,1,0.0
L'Estrigon du confluent du Luc Clabet (inclus) au confluent de la Midouze,43.9349,-0.5492,72.95,1.77,faible/nulle,fort,0-2,1475394.8,1,84.5
Le courant de Soustons du confluent du courant de Messanges à l'océan,43.7838,-1.4111,8.13,0.0,faible/nulle,faible,0-0,0.0,0,0.0
L'Esteron du vallon du Suyet inclus à la Gironde incluse,43.8689,6.8484,37.76,0.0,faible/nulle,modere,0-1,148758.4,6,0.0
Le Vicdessos (Soulcem) du confluent de l'Arbu au confluent du Siguer,42.7676,1.5243,20.42,0.0,faible/nulle,faible,0-0,17131.2,2,0.0
L'Imergue,43.9407,5.2732,17.27,1.93,faible/nulle,faible,0-0,3639.8,7,85.0
La Gimone du confluent du [toponyme inconnu] au confluent du Baquès,43.9156,1.0566,64.11,0.0,faible/nulle,modere,0-1,815178.2,4,0.0
Le Rance du confluent du Merdanson au confluent du Gos,43.8951,2.569,20.18,16.6,forte,faible,2-0,16263.8,2,99.1
Le Largue de la Laye à la Durance,43.8885,5.8398,98.06,0.0,faible/nulle,fort,0-2,634861501.8,3,0.0
L'Asse de Blieux,43.8926,6.3922,58.28,0.0,faible/nulle,modere,0-1,555503.0,3,0.0
L'Esteron de sa source au vallon du Suyet,43.8496,6.7299,41.95,0.0,faible/nulle,modere,0-1,197541.2,3,0.0
L'Izaute du confluent du Coupé (inclus) au confluent de la Gélise,43.9346,0.1225,46.31,0.0,faible/nulle,modere,0-1,262672.0,1,0.0
Le Coulon de la Doa à l'Urbane,43.9321,5.409,21.22,0.0,faible/nulle,faible,0-0,21470.0,2,0.0
Les Sorgues,43.9656,5.02,98.38,14.33,forte,fort,2-2,859330123.8,13,98.7
Le Dourdou (de Camarès) du confluent du Grauzou au confluent de la Sorgues,43.9188,2.8285,45.66,0.0,faible/nulle,modere,0-1,250423.2,1,0.0
Le Dourdou (de Camarès) du confluent de la Sorgues au confluent du Tarn,43.9668,2.7942,41.82,0.0,faible/nulle,modere,0-1,196347.2,2,0.0
La Cézone,43.9277,0.9666,72.97,0.0,faible/nulle,fort,0-2,1479651.0,2,0.0
Le Rance du confluent du Gos au confluent du Tarn,43.9502,2.568,8.13,0.0,faible/nulle,faible,0-0,0.0,1,0.0
Le Tarn du confluent du Gaycre au confluent du Moulin de Trouche,43.9275,2.4169,42.67,0.0,faible/nulle,modere,0-1,208594.4,4,0.0
Le Tarn du confluent du confluent du Moulin de Traouche au confluent du Lagouste (inclus),43.9567,2.3513,62.98,0.0,faible/nulle,modere,0-1,753515.0,1,0.0
Le Tarn du confluent du Lagouste au confluent du Sarlan,43.9564,2.3005,29.52,0.0,faible/nulle,faible,0-0,70319.4,5,0.0
Le Tescou de sa source au confluent de la Rivierette (incluse),43.9179,1.7494,23.78,5.22,moderee,faible,1-0,34617.2,1,92.0
Le Tescou du confluent du Tescounet au confluent du Tarn,43.9615,1.4169,54.26,0.0,faible/nulle,modere,0-1,445319.6,2,0.0
La Garonne du confluent du Tarn au confluent de l'Ayroux (inclus),43.9981,0.9132,85.17,0.15,faible/nulle,fort,0-2,4717476.8,15,80.3
La Gave de Pau de sa source au confluent du Pailla,42.7002,-0.0205,8.13,0.0,faible/nulle,faible,0-0,0.0,0,0.0
La Douze du confluent de l'Uby au confluent du Joutan,43.9314,-0.1036,75.18,0.0,faible/nulle,fort,0-2,1729292.4,4,0.0
