nom_bassin_versant,latitude_centroide,longitude_centroide,quantile_prelevement_national,score_secheresse,classe_secheresse,classe_prelevement,classe_bivariee,volume_moyen_preleve_m3_an,nb_communes,rang_secheresse_national
C.de Bergues et C.de Bourbourg de l'écluse Jeu de Mail au C.de Mardyck et C.de Mardyck et C. de l'île Jeanty,50.9834,2.3191,38.39,0.0,faible/nulle,modere,0-1,155959.0,5,0.0
Le Var de la Roudoule incluse au Cians,43.9795,6.9101,41.75,0.0,faible/nulle,modere,0-1,194682.6,3,0.0
Le Fusain du confluent du Maurepas (exclu) au confluent du Petit Fusain (exclu),48.0758,2.5687,70.59,0.0,faible/nulle,fort,0-2,1257929.4,1,0.0
Le courant de Soustons du confluent de la Dêche au confluent du Bouyic,43.77,-1.3352,8.13,0.0,faible/nulle,faible,0-0,0.0,0,0.0
L'Orbiquet du confluent de la Courtonne (exclu) au confluent de la Touques (exclu),49.1273,0.2544,55.31,0.0,faible/nulle,modere,0-1,467394.2,1,0.0
La Touques du confluent du Pré d'Auge (exclu) au confluent du Chaussey (exclu),49.2228,0.232,61.35,0.0,faible/nulle,modere,0-1,667704.4,4,0.0
La Garonne du confluent de l'Hers Mort au confluent de la Save,43.7767,1.3034,8.13,0.0,faible/nulle,faible,0-0,0.0,0,0.0
La Diège (Langlade) du confluent de la Sarsonne au confluent de la Gane,45.5013,2.3475,8.13,0.0,faible/nulle,faible,0-0,0.0,1,0.0
Le Réveillon du confluent du ru de la Ménagerie (exclu) au confluent de l'Yerres (exclu),48.7313,2.5554,77.35,0.0,faible/nulle,fort,0-2,2054548.4,6,0.0
L'Yerres du confluent du ru du Cornillot (exclu) au confluent du Réveillon (exclu),48.6779,2.5447,81.14,3.35,moderee,fort,1-2,3024802.4,7,88.6
L'Orb de la Mare au Jaur,43.5952,3.0485,96.3,0.58,faible/nulle,fort,0-2,212055990.8,11,81.0
Le Loing du confluent de l'Ouanne (exclu) au confluent du Puiseaux (exclu),47.985,2.7792,72.39,0.0,faible/nulle,fort,0-2,1426647.0,2,0.0
Le gave de Pau du confluent du Gave d'Azun au confluent du Bergons,43.013,-0.0842,25.48,0.0,faible/nulle,faible,0-0,44047.4,1,0.0
Le Doubs de la Loue à l'Orain,46.9982,5.4126,57.86,0.0,faible/nulle,modere,0-1,543793.2,3,0.0
LA NIEVRE DE LA NIEVRE D'ARZEMBOUY (NC) A LA LOIRE (NC),47.0566,3.2154,65.87,0.0,faible/nulle,modere,0-1,910161.6,9,0.0
La Grande Rhue du confluent du Taurons au confluent de la Rhue de Cheylade,45.3529,2.6713,8.13,0.0,faible/nulle,faible,0-0,0.0,0,0.0
Le Caudeau du confluent du Marmelet au confluent de la Dordogne,44.8473,0.4535,8.13,0.0,faible/nulle,faible,0-0,0.0,0,0.0
Le Thiou,45.7994,6.2032,97.85,0.0,faible/nulle,fort,0-2,544650428.2,17,0.0
LA GRANDE SAULDRE DE LA SALEREINE (NC) A LA NERE (NC),47.4972,2.5311,77.85,0.0,faible/nulle,fort,0-2,2165583.2,9,0.0
La Duche du confluent de la Petite Duche au confluent de l'Isle,45.0557,0.0959,8.13,0.0,faible/nulle,faible,0-0,0.0,0,0.0
La Cesse,43.365,2.7797,90.77,6.72,forte,fort,2-2,15912479.0,14,94.1
L'Aude de l'Orbiel au Mayral,43.2049,2.5135,98.56,0.0,faible/nulle,fort,0-2,944677954.2,18,0.0
LA GARTEMPE DU RIOU (NC) A L'ANGLIN (NC),46.5627,0.853,95.14,6.39,forte,fort,2-2,128785573.4,10,93.5
La Seugne du confluent de la Rochette au confluent du Trèfle,45.4974,-0.5124,8.13,0.0,faible/nulle,faible,0-0,0.0,0,0.0
L'Eyraud du confluent du Tulen au confluent de la Dordogne,44.8634,0.3581,8.13,0.0,faible/nulle,faible,0-0,0.0,0,0.0
L'Yerres du confluent de l'Yvron (exclu) au confluent du ru de Bréon (exclu),48.6498,2.8816,24.96,0.0,faible/nulle,faible,0-0,41359.4,4,0.0
L'Isère du ruisseau de Bénétant inclus à l'Arly,45.6392,6.4699,97.29,0.0,faible/nulle,fort,0-2,380687262.4,5,0.0
LA DORE DU RAU DE CHAMPETIERES (NC) AU RAU DE BATIFOL,45.5488,3.7297,59.51,0.0,faible/nulle,modere,0-1,598928.2,5,0.0
Côtiers du Guadu grande inclus au Fium Albino,42.7669,9.3587,38.25,0.0,faible/nulle,modere,0-1,154535.2,5,0.0
La Berre de sa source au Barrou inclus,42.9631,2.7826,42.28,0.0,faible/nulle,modere,0-1,202215.0,8,0.0
L'Orbieu du ruisseau d'Albières au ruisseau de Buet inclus,42.9791,2.5202,71.93,0.0,faible/nulle,fort,0-2,1375856.2,8,0.0
La Garonne du confluent du Rieutord (inclus) au confluent du Ger,43.0906,0.7622,33.04,0.0,faible/nulle,faible,0-0,100006.0,2,0.0
Canal de l'Espierre de l'écluse numéro 10 Calvaire à l'écluse numéro 11 Galon d'eau,50.6941,3.1903,8.13,0.0,faible/nulle,faible,0-0,0.0,0,0.0
La Laize de sa source au confluent du ruisseau du Grand Etang (inclus),48.9242,-0.3221,16.55,0.0,faible/nulle,faible,0-0,855.8,5,0.0
La Dordogne du confluent du Gestas au confluent du Frayche,44.9252,-0.3269,63.13,0.0,faible/nulle,modere,0-1,761183.8,5,0.0
Le Butturacci et les Côtiers du Taravo au ruisseau de Ruppione,41.7579,8.7496,19.68,0.0,faible/nulle,faible,0-0,13850.8,1,0.0
Canal du Nord 1ère section de l'écluse numéro 12 Cléry au confluent du Canal de la Somme,49.9376,2.9012,8.13,0.0,faible/nulle,faible,0-0,0.0,0,0.0
La Taute du confluent de la Meule (exclu) au confluent du Lozon (exclu),49.192,-1.3331,32.22,0.0,faible/nulle,faible,0-0,93201.0,4,0.0
L'Odon du confluent de la Douvette (exclu) au confluent de l'Ajon (exclu),49.0768,-0.6084,8.13,0.0,faible/nulle,faible,0-0,0.0,2,0.0
Le Marilhou du confluent du Marderet au confluent de la Sumène,45.2944,2.4047,8.13,0.0,faible/nulle,faible,0-0,0.0,0,0.0
L'ARON DU GUIGNON (NC) A L'ALENE (NC),46.9228,3.8207,52.08,0.0,faible/nulle,modere,0-1,387030.4,7,0.0
La Cèze du ruisseau de Malaygue à l'Aiguillon inclus,44.2242,4.4,63.21,7.07,forte,modere,2-1,769950.0,13,94.5
Le Gardon d'Alès,44.1706,4.0221,87.51,0.0,faible/nulle,fort,0-2,7032276.8,27,0.0
Cours d'eau se jetant en mer du Cap Blanc Nez à l'embouchure de la Slack,50.8688,1.6638,36.97,0.0,faible/nulle,modere,0-1,140748.4,7,0.0
Canal du Nord 1ère section de l'écluse numéro 10 Allaines à l'écluse numéro 11 Feuillaucourt,49.9622,2.9375,8.13,0.0,faible/nulle,faible,0-0,0.0,0,0.0
Canal de Calais de l'écluse Hennuin à l'écluse Calais,50.8839,1.9557,61.88,0.0,faible/nulle,modere,0-1,703696.0,8,0.0
Canal de St-Quentin de l'écluse numéro 2 Cantigneul à l'écluse numéro 1 Proville,50.1601,3.1884,8.13,0.0,faible/nulle,faible,0-0,0.0,0,0.0
Lys Canalisée de l'écluse numéro 2 Cense à Witz à l'écluse numéro 3 Saint Venant,50.6353,2.4868,8.13,0.0,faible/nulle,faible,0-0,0.0,1,0.0
Baie de St-Valéry-sur-Somme,50.1898,1.7021,86.59,2.91,moderee,fort,1-2,5940195.8,65,87.8
Canal de jonction du confluent de la Scarpe Canalisée au confluent de la dérivation de la Scarpe,50.3856,3.0848,8.13,0.0,faible/nulle,faible,0-0,0.0,0,0.0
Canal de l'Espierre de l'écluse numéro 11 Galon d'eau à l'écluse numéro 12 Sartel,50.6923,3.199,8.13,0.0,faible/nulle,faible,0-0,0.0,0,0.0
La Cance du confluent du Canèon (exclu) au confluent de la Sélune (exclu),48.6281,-0.9469,8.13,0.0,faible/nulle,faible,0-0,0.0,0,0.0
La Joigne de sa source au confluent de la Vire (exclu),49.059,-1.1892,8.13,0.0,faible/nulle,faible,0-0,0.0,2,0.0
L'Allière du confluent de la rivière du Maine (inclus) au confluent de la Vire (exclu),48.8474,-0.809,8.13,0.0,faible/nulle,faible,0-0,0.0,0,0.0
L'Arques du confluent de l'Eaulne (exclu) à l'embouchure,49.9155,1.1211,81.98,0.0,faible/nulle,fort,0-2,3250117.8,4,0.0
LE LIE DU J812400 (C) AU J813400 (NC),48.2506,-2.5981,8.13,0.0,faible/nulle,faible,0-0,0.0,0,0.0
La Rhue de Cheylade du confluent du Bréchailles au confluent de la Grolle,45.2724,2.701,8.13,0.0,faible/nulle,faible,0-0,0.0,0,0.0
L'Essonne de sa source au confluent de la Rimarde (exclu),48.1137,2.1613,88.93,8.63,forte,fort,2-2,9180612.2,18,96.2
La Céronne de sa source au confluent du [toponyme inconnu] (inclus),45.3258,1.7193,8.13,0.0,faible/nulle,faible,0-0,0.0,0,0.0
La Vire du confluent du ruisseau du Précurbin (exclu) au confluent du Fumichon (exclu),49.056,-1.0671,8.13,0.0,faible/nulle,faible,0-0,0.0,1,0.0
La Jâcre de sa source au confluent de la Vire (exclu),48.9955,-0.9784,8.13,0.0,faible/nulle,faible,0-0,0.0,2,0.0
Les bassin côtiers compris entre le bassin de la Seine (exclu) et l'embouchure de la Touques (exclu),49.3788,0.1015,8.13,0.0,faible/nulle,faible,0-0,0.0,1,0.0
Le Trèvezel de sa source au confluent du Bonheur (inclus),44.104,3.4915,29.15,0.0,faible/nulle,faible,0-0,66996.6,1,0.0
La Vére du confluent de la Visance (exclu) au confluent du Noireau (exclu),48.8033,-0.5321,8.13,0.0,faible/nulle,faible,0-0,0.0,1,0.0
LA CLAISE DU CLERCQ (NC) A L'AIGRONNE (NC),46.8468,0.9351,57.54,5.11,moderee,modere,1-1,534059.8,5,91.8
LA SEVRE NANTAISE DE LA GRANDE CRUME (C) AU MOINE (NC),46.9967,-1.1124,75.62,3.59,moderee,fort,1-2,1781669.4,5,89.2
La Palue du confluent du Couloum à l'océan,43.8742,-1.3656,8.13,0.0,faible/nulle,faible,0-0,0.0,0,0.0
LE QUILLIMADEC DE SA SOURCE A LA MER,48.5913,-4.3443,8.13,0.0,faible/nulle,faible,0-0,0.0,6,0.0
L'ISE & SES AFFLUENTS,47.9626,-1.5921,37.92,0.0,faible/nulle,modere,0-1,150323.6,8,0.0
La Vie du confluent de l'Algot (exclu) au confluent de la Dives (exclu),49.1363,-0.008,8.13,0.0,faible/nulle,faible,0-0,0.0,1,0.0
La Lézarde du confluent du ru la Clinarderie (exclu) au confluent de la Rouelles (exclu),49.5388,0.1866,65.02,0.0,faible/nulle,modere,0-1,861065.4,1,0.0
Canal de St-Quentin de l'écluse numéro 17 Bosquet à l'écluse numéro 16 Moulin Lafosse,50.0307,3.1972,8.13,0.0,faible/nulle,faible,0-0,0.0,0,0.0
Canal du Nord de l'écluse numéro 4 Sains-les-Marquion à l'écluse numéro 3 Sains-les-Marquion,50.1832,3.0653,8.13,0.0,faible/nulle,faible,0-0,0.0,0,0.0
Les bassins côtiers compris entre la limite du bassin Artois-Picardie (exclu) et l'embouchure de la Bresle (exclu),50.079,1.4142,8.13,0.0,faible/nulle,faible,0-0,0.0,0,0.0
La Lézarde du confluent de la Rouelles (exclu) au confluent du ruisseau de Saint Laurent (exclu),49.512,0.1894,8.13,0.0,faible/nulle,faible,0-0,0.0,0,0.0
Le Bradascou du confluent du Ganaveix au confluent de la Piquette,45.4489,1.6064,8.13,0.0,faible/nulle,faible,0-0,0.0,0,0.0
Les bassins côtiers compris entre l'embouchure de la Bresle (exclu) et l'embouchure de l'Yères (exclu),50.0356,1.3522,8.13,0.0,faible/nulle,faible,0-0,0.0,1,0.0
L'Arques du confluent de la Varenne (exclu) au confluent de l'Eaulne (exclu),49.8897,1.1276,8.13,0.0,faible/nulle,faible,0-0,0.0,0,0.0
Le Canal des Landes du bassin d'Arcachon au confluent de la craste Baneyre (incluse),44.6395,-1.1097,8.13,0.0,faible/nulle,faible,0-0,0.0,0,0.0
La Juine du confluent de la Challouette (exclu) au confluent de l'Essonne (exclu),48.5006,2.233,87.83,0.0,faible/nulle,fort,0-2,7480440.0,15,0.0
LA LOIRE DE L'AIX (NC) A LA GOUTTE DE TRENNE (C),45.8974,4.1144,65.73,0.0,faible/nulle,modere,0-1,902297.0,6,0.0
LE FURAN & SES AFFLUENTS,45.4688,4.4017,86.57,2.22,faible/nulle,fort,0-2,5939177.2,12,85.9
LA DOLORE & SES AFFLUENTS,45.476,3.6269,89.72,0.0,faible/nulle,fort,0-2,11464992.2,6,0.0
LA LOIRE DE L'ANCE (du nord) (NC) AU RAU DE TRANCHARD (NC),45.3091,4.1391,94.3,0.0,faible/nulle,fort,0-2,80437855.0,4,0.0
La Durance de l'Asse incluse au Largue (zones X140 à X143 exclues),43.9152,6.0399,79.82,0.0,faible/nulle,fort,0-2,2574288.6,5,0.0
RAU DE KERLOC'H DE SA SOURCE A LA MER & COTIERS DE LA POINTE DES ESPAGNOLS AU CAP DE LA CHEVRE,48.2603,-4.5465,8.13,0.0,faible/nulle,faible,0-0,0.0,1,0.0
LA JOUANNE DE LA DEUX EVAILLES (NC) A LA MAYENNE (NC),48.1021,-0.6269,58.98,0.0,faible/nulle,modere,0-1,579089.2,7,0.0
LA LOIRE DE L'IXEURE (C) A LA COLATRE (NC),46.9862,3.3638,69.43,0.0,faible/nulle,fort,0-2,1161282.0,9,0.0
L'Isère du Drac à la Vence,45.1676,5.6302,39.15,0.0,faible/nulle,modere,0-1,164461.6,3,0.0
La Sienne du confluent de l'Hambyotte (exclu) au confluent de la Bérence (exclu),48.9286,-1.3104,8.13,4.7,moderee,faible,1-0,0.0,2,91.2
LA CHEUILLE & SES AFFLUENTS,47.5729,2.9456,72.13,0.0,faible/nulle,fort,0-2,1389246.6,3,0.0
La Blind de son origine (sur le Canal de Colmar) à la rigole de Widensohlen (inclus).,48.1215,7.4589,43.25,0.0,faible/nulle,modere,0-1,216280.8,1,0.0
Le Fresquel du ruisseau de Tréboul au Lampy,43.2107,2.1035,67.38,0.0,faible/nulle,fort,0-2,1010335.6,10,0.0
LE LOC'H DE SA SOURCE AU RAU DE PONT CHRIST (NC),47.7754,-2.8912,65.54,0.0,faible/nulle,modere,0-1,892356.0,5,0.0
LA CANNE & SES AFFLUENTS,46.9987,3.5709,8.13,2.28,faible/nulle,faible,0-0,0.0,8,86.1
L'ACOLIN DU BREUIL (C) A L'OZON (NC),46.6024,3.5165,53.6,0.0,faible/nulle,modere,0-1,423976.8,3,0.0
Scarpe Canalisée de l'écluse numéro 28 Saint-Nicolas à l'écluse numéro 29 Saint Laurent Blangy,50.2855,2.6136,88.56,0.0,faible/nulle,fort,0-2,8446660.8,69,0.0
Le Taurons,45.3995,2.7025,8.13,0.0,faible/nulle,faible,0-0,0.0,2,0.0
Le Colinet,45.1032,-0.4259,48.75,0.0,faible/nulle,modere,0-1,308867.4,3,0.0
La Sinope de sa source au confluent du ruisseau de Franqueterre (inclus),49.5587,-1.4001,35.27,0.0,faible/nulle,modere,0-1,122510.4,5,0.0
L'Yerres du confluent de la Marsange (exclu) au confluent du ru d'Avon (exclu),48.6597,2.7775,8.13,0.0,faible/nulle,faible,0-0,0.0,0,0.0
La Vire du confluent de la Brévogne (exclu) au confluent du ruisseau des Haises (inclus),48.9024,-0.8568,8.13,6.0,moderee,faible,1-0,0.0,0,93.1
La Vaux du confluent du Plumion (exclu) au confluent de l'Aisne (exclu),49.5496,4.2822,8.13,0.0,faible/nulle,faible,0-0,0.0,1,0.0
La Sée du confluent de la Bouanne (exclu) au confluent du Glanon (exclu),48.7121,-1.0592,8.13,0.0,faible/nulle,faible,0-0,0.0,3,0.0
Canche de l'amont du confluent du Bras de Bronne à la Manche,50.5349,1.7795,83.31,0.0,faible/nulle,fort,0-2,3753182.6,46,0.0
Canal de St-Quentin de l'écluse numéro 12 Vaucelle à l'écluse numéro 11 Tordoir,50.0823,3.2222,8.13,0.0,faible/nulle,faible,0-0,0.0,0,0.0
Le Trèfle du confluent du Tatre au confluent du Noble,45.4951,-0.3514,51.95,0.0,faible/nulle,modere,0-1,384106.0,5,0.0
La Reyssouze de sa source au Clairtant inclus,46.1293,5.2783,37.39,0.0,faible/nulle,modere,0-1,145198.8,6,0.0
Le Rhône du Furans au Guiers,45.6433,5.6782,94.46,0.0,faible/nulle,fort,0-2,91883155.2,7,0.0
LA VAUVIZE DE SA SOURCE AU LISERON (C),47.0751,2.8723,35.34,0.0,faible/nulle,modere,0-1,123078.4,7,0.0
La Gine de sa source au confluent de la Rouvre (exclu),48.7539,-0.4594,8.13,0.75,faible/nulle,faible,0-0,0.0,2,81.5
La Vezouze du ruisseau de la Baraque au ruisseau des Amis.,48.5782,6.6544,48.67,0.0,faible/nulle,modere,0-1,307454.8,3,0.0
La Sarre des deux Sarre à la Bièvre.,48.6994,6.9472,65.91,0.0,faible/nulle,modere,0-1,910919.8,16,0.0
La Seudre de sa source au confluent de la Bénigousse,45.5111,-0.6695,74.21,5.24,moderee,fort,1-2,1599872.2,8,92.0
La Touques du confluent du ru Saint Evroult (exclu) au confluent du ruisseau de Chaumont (exclu),48.835,0.2716,55.24,0.0,faible/nulle,modere,0-1,466570.4,2,0.0
La Détresse,45.0281,-0.2558,8.13,0.0,faible/nulle,faible,0-0,0.0,2,0.0
Canal de St-Quentin de l'écluse numéro 20 Omissy à l'écluse numéro 21 Moulin Brûlé et la rigole de Cauvigny,49.872,3.3135,8.13,0.0,faible/nulle,faible,0-0,0.0,0,0.0
LE STEIR DU J430580 (NC) A L'ODET (NC),48.0455,-4.1461,8.13,0.0,faible/nulle,faible,0-0,0.0,2,0.0
L'ANTONNIERE & SES AFFLUENTS,48.0728,0.0927,64.68,0.0,faible/nulle,modere,0-1,843256.4,10,0.0
La Madeleine,47.6845,6.9256,40.83,3.42,moderee,modere,1-1,181871.8,20,88.8
LA MAYENNE DU PONT-PERDREAU (C) AU CHOISEAU (C),47.8454,-0.6633,76.31,0.0,faible/nulle,fort,0-2,1884039.2,3,0.0
LE LOIR DE SON BRAS M151700 (NC) AU VERDUN (C),47.6388,-0.1497,66.08,0.0,faible/nulle,modere,0-1,924604.2,1,0.0
L'Ognon du Rahin au Lauzin inclus,47.6028,6.5021,94.23,0.0,faible/nulle,fort,0-2,76403883.8,46,0.0
LE LOIR DE LA FONTAINE DE SASNIERES (NC) A LA BRAYE (NC),47.7567,0.8076,72.61,5.32,moderee,fort,1-2,1441266.4,15,92.1
LE LOIR DU VERDUN (NC) AU RAU DU PONT RAME BOISGOURD (C),47.6604,-0.2127,77.28,16.48,forte,fort,2-2,2044113.2,5,99.1
LA BRAS & SES AFFLUENTS,47.5603,2.6513,61.37,0.0,faible/nulle,modere,0-1,667738.8,4,0.0
Le Doubs du Drugeon au ruisseau de la Tanche incluse,47.028,6.4615,78.3,0.0,faible/nulle,fort,0-2,2256791.8,16,0.0
La Loue de sa source à la Brême incluse,47.0891,6.2447,98.9,0.0,faible/nulle,fort,0-2,1391557991.8,27,0.0
La Cèze de sa source au Luech,44.3578,3.9919,49.6,0.0,faible/nulle,modere,0-1,331131.6,7,0.0
LE GRAND LAY DU LOING (NC) AU PETIT LAY (NC),46.6805,-1.0291,72.86,0.0,faible/nulle,fort,0-2,1461036.2,2,0.0
L'YON DE SA SOURCE AU RAU DE L'ORNAY (NC),46.6974,-1.3646,84.6,5.69,moderee,fort,1-2,4388593.0,2,92.6
LA PETITE CREUSE DU RAU DU MOULIN DE GAUTROU (NC) A LA CREUSE (NC),46.3872,1.8056,54.34,0.0,faible/nulle,modere,0-1,446855.4,8,0.0
La Chiers de la Bièvre à la Marche.,49.5532,5.2284,25.21,0.0,faible/nulle,faible,0-0,42431.4,4,0.0
La Touques du confluent du ruisseau de Lecange (exclu) au confluent de l'Orbiquet (exclu),49.1043,0.1984,8.13,0.0,faible/nulle,faible,0-0,0.0,2,0.0
LA RANCE DU FREMEUR (C) AU BARRAGE DE ROPHEMEL (C),48.2852,-2.0923,78.22,0.0,faible/nulle,fort,0-2,2242893.8,8,0.0
Le Tech de la ribera de la Menera inclus à la Quère incluse,42.3852,2.5668,35.53,0.0,faible/nulle,modere,0-1,125155.8,3,0.0
La Dordogne du confluent de la Ramade au confluent de la Jarrige,45.5488,2.5175,8.13,0.0,faible/nulle,faible,0-0,0.0,0,0.0
LA CLAISE DE L'AIGRONNE (NC) A LA CREUSE (NC),46.9404,0.9233,71.24,0.0,faible/nulle,fort,0-2,1312978.0,10,0.0
Le Var de a Barlatte incluse au ravin de Chaudan,44.1118,6.8628,89.69,0.0,faible/nulle,fort,0-2,11423682.4,4,0.0
Canal de St-Quentin de l'écluse numéro 9 Crève-Coeur à l'écluse numéro 8 St-Vaast,50.1034,3.2437,8.13,0.0,faible/nulle,faible,0-0,0.0,0,0.0
Canal de St-Quentin de l'écluse numéro 14 Banteux à l'écluse numéro 13 Bantouzelle,50.0616,3.2009,8.13,0.0,faible/nulle,faible,0-0,0.0,0,0.0
Lys Canalisée du confluent du Canal d'Aire à la Bassée à l'écluse numéro 1 Fort-Gassion,50.6455,2.4128,8.13,0.0,faible/nulle,faible,0-0,0.0,0,0.0
Canal de la Somme du confluent du Canal de St-Quentin à l'écluse numéro 2 Ham,49.7444,3.112,8.13,0.0,faible/nulle,faible,0-0,0.0,0,0.0
Canal de St-Quentin de l'écluse numéro 7 de Masnières à l'écluse numéro 6 Bracheux,50.1137,3.208,8.13,0.0,faible/nulle,faible,0-0,0.0,0,0.0
La Risle du confluent du ruisseau de Vieux Bourg (exclu) au confluent du ruisseau de Corru (inclus),48.7353,0.4897,53.26,0.0,faible/nulle,modere,0-1,416589.0,7,0.0
Le Lez de la Lironde incluse la mer Méditerranée,43.6184,3.8864,86.73,1.42,faible/nulle,fort,0-2,6159250.8,3,83.3
L'Hérault de la Lergue au ruisseau de Rouvièges,43.5975,3.4408,83.33,0.0,faible/nulle,fort,0-2,3755732.6,10,0.0
Le Job du confluent du Ouastadet au confluent du Ger,43.0501,0.7583,8.13,0.0,faible/nulle,faible,0-0,0.0,1,0.0
La Sée du confluent du Glanon (exclu) au confluent du ruisseau de Saint Laurent (exclu),48.6991,-1.1209,32.12,0.0,faible/nulle,faible,0-0,91674.4,2,0.0
La Lèze du confluent du Guillot au confluent du Riquetou (inclus),43.3543,1.3234,8.13,2.27,faible/nulle,faible,0-0,0.0,1,86.0
Le Merderet du confluent du Brocq (exclu) au confluent de la Douve (exclu),49.3934,-1.3455,70.01,0.0,faible/nulle,fort,0-2,1203663.2,2,0.0
L'Aisne du confluent du ru d'Hozien (exclu) au confluent du ru de Vandy (exclu),49.4177,3.0772,80.47,0.0,faible/nulle,fort,0-2,2768452.6,8,0.0
Le ruisseau du Val Dupuis de sa source au confluent de la Laignes (exclu),47.9374,4.4337,25.35,0.0,faible/nulle,faible,0-0,43483.0,2,0.0
La Cance du confluent du ruisseau des Landelles (exclu) au confluent de l'Orne (exclu),48.6697,-0.0825,8.13,0.0,faible/nulle,faible,0-0,0.0,3,0.0
La Touques du confluent du ruisseau de la Basse Rue (exclu) au confluent du ruisseau du Vaunoy (exclu),49.3178,0.106,8.13,0.0,faible/nulle,faible,0-0,0.0,1,0.0
L'Automne du confluent du ru de Sainte Marie (exclu) au confluent de l'Oise (exclu),49.2971,2.7863,58.72,0.0,faible/nulle,modere,0-1,569770.2,7,0.0
L'Esque de sa source au confluent du ruisseau du Lonclon (inclus),49.2143,-0.9354,8.13,0.0,faible/nulle,faible,0-0,0.0,4,0.0
Le ruisseau du Pont Saint Esprit de sa source au confluent de la Seulles (exclu),49.1724,-0.6683,8.13,0.0,faible/nulle,faible,0-0,0.0,2,0.0
LA SARTHE DE L'HOENE (C) A LA PERVENCHE (C),48.5074,0.4267,55.91,0.0,faible/nulle,modere,0-1,485993.0,19,0.0
La Seulline de sa source au confluent de la Seulles (exclu),49.0715,-0.684,16.5,0.0,faible/nulle,faible,0-0,488.0,5,0.0
L'Arques de sa source au confluent du ruisseau du Thil (inclus),49.6544,1.6204,33.37,0.0,faible/nulle,modere,0-1,102870.8,1,0.0
La Mue du confluent de la Chironne (exclu) au confluent de la Seulles (exclu),49.2742,-0.4476,70.46,0.0,faible/nulle,fort,0-2,1243628.6,4,0.0
L'ODET DE SA SOURCE AU J421400 (NC),48.0869,-3.8703,55.99,0.0,faible/nulle,modere,0-1,487656.8,5,0.0
Le Sorson de sa source au confluent de l'Arques (exclu),49.6522,1.4826,36.87,7.67,forte,modere,2-1,139911.8,3,95.2
La Dordogne du confluent de la Cascade au confluent des Firgues (inclus),45.2303,2.0608,8.13,0.0,faible/nulle,faible,0-0,0.0,1,0.0
La Muance du confluent de la Vieille Rivière (inclus) au confluent de la Dives,49.1595,-0.1424,8.13,0.0,faible/nulle,faible,0-0,0.0,1,0.0
La Charente du confluent du Pas de la Mule au confluent de la Lizonne,46.0699,0.2527,54.71,0.0,faible/nulle,modere,0-1,453816.0,1,0.0
La Joyeuse de sa source au confluent du Garraldako Erreka,43.3325,-1.2764,59.44,0.0,faible/nulle,modere,0-1,595013.8,3,0.0
La Seille du ruisseau de Saint-Jean au ruisseau de Vulmont (inclus).,48.9253,6.303,8.13,0.0,faible/nulle,faible,0-0,0.0,5,0.0
L'Isle du confluent de la Dronne au confluent du Lary,45.033,-0.1578,8.13,0.0,faible/nulle,faible,0-0,0.0,0,0.0
L'Ouysse de sa source au confluent de l'Aynac,44.7538,1.8935,8.13,0.0,faible/nulle,faible,0-0,0.0,2,0.0
LE TRIEUX DU RAU DE SULLE (C) AU RAU DU BOIS DE LA ROCHE (NC),48.4729,-3.1403,8.13,0.0,faible/nulle,faible,0-0,0.0,4,0.0
L'Isère du torrent d'Eau Rousse au ruisseau de Bénétant,45.5876,6.4807,89.66,0.0,faible/nulle,fort,0-2,11326882.8,2,0.0
Le Manoire du confluent du Saint-Geyrac au confluent de l'Isle,45.1546,0.7947,77.69,0.0,faible/nulle,fort,0-2,2144764.4,1,0.0
La Touvre,45.6772,0.2279,42.04,10.67,forte,modere,2-1,198766.4,5,97.5
La Save du confluent de la Garenne au confluent du Cérès,43.6377,1.1524,46.07,0.0,faible/nulle,modere,0-1,257600.8,5,0.0
L'ARROUX DE LA BOURBINCE (NC) A LA LOIRE (NC),46.495,3.9823,8.13,0.0,faible/nulle,faible,0-0,0.0,0,0.0
La Moselle du ruisseau de la Croisette à la Moselotte.,47.9948,6.6253,8.13,0.0,faible/nulle,faible,0-0,0.0,0,0.0
Le Moulin des Rivauds,45.7516,0.202,68.28,0.0,faible/nulle,fort,0-2,1085072.8,5,0.0
L'YAIGNE & SES AFFLUENTS,48.0626,-1.4636,32.06,0.0,faible/nulle,faible,0-0,90662.8,3,0.0
Le Lary du confluent du Placin (inclus) au confluent du Palais,45.1664,-0.2238,19.94,5.46,moderee,faible,1-0,15055.8,2,92.3
La Lidoire du confluent du Lechout au confluent de la Dordogne,44.8783,-0.0113,17.08,0.0,faible/nulle,faible,0-0,2804.0,3,0.0
Canal de la Somme de l'écluse numéro 2 Ham à l'écluse numéro 3 Ham,49.743,3.0746,8.13,0.0,faible/nulle,faible,0-0,0.0,0,0.0
LA COUZE & SES AFFLUENTS,46.0564,1.3062,88.24,0.0,faible/nulle,fort,0-2,8143634.6,4,0.0
Les bassins côtiers compris entre l'embouchure de la Scie (exclu) et l'embouchure de la Saâne (exclu),49.9124,0.9884,8.13,0.0,faible/nulle,faible,0-0,0.0,0,0.0
L'Arques du confluent du Sorson (exclu) au confluent de la Canche (exclu),49.7101,1.498,27.79,0.0,faible/nulle,faible,0-0,57571.4,2,0.0
La Dives du confluent de la Dorette (exclu) au confluent du Laizon (exclu),49.163,-0.0825,8.13,0.0,faible/nulle,faible,0-0,0.0,0,0.0
L'ABER-ILDUT DU J332400 (C) A LA MER,48.4606,-4.7076,22.91,0.0,faible/nulle,faible,0-0,29850.6,5,0.0
L'ARZ DE SA SOURCE AU RAU DE SAINT GENTIEN (NC),47.7391,-2.5467,31.23,0.0,faible/nulle,faible,0-0,83806.0,6,0.0
LE LOIR DE LA VEUVE (NC) AU GRAVOT (NC),47.6916,0.5888,63.18,11.41,forte,modere,2-1,767311.2,12,97.9
Le Doubs de la Dessoubre à l'Allan,47.3937,6.7861,99.34,0.0,faible/nulle,fort,0-2,3114050521.8,50,0.0
COTIERS DE PORT NAVALO A L'ETIER DE KERBOULICO (NC),47.5193,-2.8138,8.13,0.0,faible/nulle,faible,0-0,0.0,3,0.0
R DE CRAC'H DE SA SOURCE A LA MER,47.5751,-3.0564,8.13,0.0,faible/nulle,faible,0-0,0.0,8,0.0
L'Allan de la Lizaine au Doubs,47.5921,6.7207,93.42,11.0,forte,fort,2-2,49808424.4,39,97.6
La Dordogne du confluent du Moron au confluent de la Garonne,45.0541,-0.5504,89.74,0.0,faible/nulle,fort,0-2,11566930.6,6,0.0
La Garonne du confluent de l'Eau Blanche au confluent de l'Ars,44.8119,-0.5117,80.56,0.0,faible/nulle,fort,0-2,2803903.8,4,0.0
La Midouze du confluent du Retjons au confluent de l'Adour,43.809,-0.8258,50.02,0.0,faible/nulle,modere,0-1,339771.2,1,0.0
La Couze du confluent du Roumaguet au confluent de la Dordogne,44.8084,0.7229,40.88,0.0,faible/nulle,modere,0-1,182454.8,1,0.0
La Douze du confluent du Nouët (inclus) au confluent de l'Estampon,44.0133,-0.2571,34.95,0.0,faible/nulle,modere,0-1,118031.2,1,0.0
L'Adour du confluent du Louts au confluent du Buglose,43.7342,-0.9517,51.16,0.0,faible/nulle,modere,0-1,370415.4,2,0.0
La Beuze,44.7198,1.0627,23.33,0.0,faible/nulle,faible,0-0,32346.6,3,0.0
LA GOZE & SES AFFLUENTS,46.2005,2.1934,27.94,0.0,faible/nulle,faible,0-0,59092.0,4,0.0
Le Gard de sa source au Gardon de Sainte Croix,44.2136,3.8044,35.58,3.2,moderee,modere,1-1,125237.8,3,88.3
Le Puy Roudeaux du confluent des Baraques au confluent du Marsaguet,45.4984,1.3639,21.3,0.0,faible/nulle,faible,0-0,21812.2,1,0.0
LA LOIRE DU LIGNON (NC) A L'ANCE (du nord) (NC),45.2733,4.1422,8.13,0.0,faible/nulle,faible,0-0,0.0,0,0.0
L'Aube du confluent du ru de Choisel (exclu) au confluent de la Seine (exclu),48.5821,3.7454,35.76,2.21,faible/nulle,modere,0-1,127950.0,2,85.8
Le Méaudret,45.1682,5.5481,53.56,0.0,faible/nulle,modere,0-1,423407.0,1,0.0
LA VILAINE DE L'ISAC (NC) A LA R DE L'ETIER (NC),47.5643,-2.1949,17.98,0.0,faible/nulle,faible,0-0,6072.6,1,0.0
Le Foulissard,45.0786,1.8367,18.84,0.0,faible/nulle,faible,0-0,9917.2,2,0.0
La Bonnieure du confluent du Marais au confluent de la Tardoire,45.8515,0.3158,66.75,0.0,faible/nulle,fort,0-2,961044.2,3,0.0
